name,isin,url
HSBC ETFS PLC HSBC USA SCR EQ UCITS ETF USD (DIST),,https://www.charles-stanley-direct.co.uk/ViewShare?InvestmentId=n0quSXdLATo%3D
JPMORGAN ETFS (IRELAND) ICAV JPM JAPAN REI UCITS ETF USD DIS,,https://www.charles-stanley-direct.co.uk/ViewShare?InvestmentId=mY3k62cFfh0%3D
JPMORGAN ETFS (IRELAND) ICAV JPM JAPAN REI UCITS ETF USD DIS,,https://www.charles-stanley-direct.co.uk/ViewShare?InvestmentId=Qc5iBFrNOXA%3D
HSBC ETFS PLC MSCI EUROPE CLMTE PARIS ALGD UTS ETF GBP,,https://www.charles-stanley-direct.co.uk/ViewShare?InvestmentId=t6k9mGQiy64%3D
HSBC ETFS PLC MSCI WRD CLM PARIS ALGD UTS ETF GBP,,https://www.charles-stanley-direct.co.uk/ViewShare?InvestmentId=tz6iBZPHJnk%3D
HSBC ETFS PLC MSCI USA CLIMATE PARIS ALGD UCTS ETF USD,,https://www.charles-stanley-direct.co.uk/ViewShare?InvestmentId=FXyX7Fohfwc%3D
HSBC ETFS PLC MSCI WRD CLM PARIS ALGD UTS ETF USD,,https://www.charles-stanley-direct.co.uk/ViewShare?InvestmentId=E3yPaL1EGZ0%3D
HSBC ETFS PLC HSBC MSCI EUROPE ISLAMIC SCR ETF EUR ACC,,https://www.charles-stanley-direct.co.uk/ViewShare?InvestmentId=n7DwodPH%2FWM%3D
HSBC ETFS PLC HSBC JAPAN SCR EQ UCITS ETF USD (DIST),,https://www.charles-stanley-direct.co.uk/ViewShare?InvestmentId=yrGA5AUbmd8%3D
JPMORGAN ETFS (IRELAND) ICAV EUR AGGREGATE BOND ACTIVE UCITS ETF EUR,,https://www.charles-stanley-direct.co.uk/ViewShare?InvestmentId=k3uKsO3vLS8%3D
HSBC ETFS PLC HSBC MSCI WORLD VALUE SCR ETF USD ACC,,https://www.charles-stanley-direct.co.uk/ViewShare?InvestmentId=IIbPxXDtszc%3D
SCHRODER ETFS ICAV SCHRODER GBL EQ ACTVE UCITS ETF USD ACC,,https://www.charles-stanley-direct.co.uk/ViewShare?InvestmentId=q%2BseXoir41Y%3D
HSBC GLOBAL FUNDS ICAV US CORPORATE BOND UCITS ETF ETFC USD,,https://www.charles-stanley-direct.co.uk/ViewShare?InvestmentId=gDCTshB5Pf8%3D
HSBC GLOBAL FUNDS ICAV GLOBAL AGGREGATE BOND ESG UCITS ETF ETFC,,https://www.charles-stanley-direct.co.uk/ViewShare?InvestmentId=o6SqkXRFZjU%3D
JPMORGAN ETFS (IRELAND) ICAV JPM EUROPE EPI UCITS ETF EUR ACC,,https://www.charles-stanley-direct.co.uk/ViewShare?InvestmentId=ujobMisR9Co%3D
JPMORGAN ETFS (IRELAND) ICAV JPM EUROPE EPI UCITS ETF EUR DIS,,https://www.charles-stanley-direct.co.uk/ViewShare?InvestmentId=o1j4kNfwFn4%3D
JPMORGAN ETFS (IRELAND) ICAV GLOBAL AGGREGATE BOND ACTIVE UCITS ETF U,,https://www.charles-stanley-direct.co.uk/ViewShare?InvestmentId=RSDD3JVRhs0%3D
JPMORGAN ETFS (IRELAND) ICAV GLOBAL EQTY MULTIFACT UCITS ETF USD DIST,,https://www.charles-stanley-direct.co.uk/ViewShare?InvestmentId=aMSGiBiCcQo%3D
LEGAL & GENERAL UCITS ETF PLC L&G GBP CORP BOND SCRND ETF GBP DIST,,https://www.charles-stanley-direct.co.uk/ViewShare?InvestmentId=2gYm2dglyFc%3D
GOLDMAN SACHS ETF ICAV GS ALPHA ENH WORLD EQ ACT UC ETF USD ACC,,https://www.charles-stanley-direct.co.uk/ViewShare?InvestmentId=eXHO0ovCtYw%3D
UBS (IRL) ETF PLC UBS (IRL) S&P 500 ESG ELIT UCT ETF A USD,,https://www.charles-stanley-direct.co.uk/ViewShare?InvestmentId=FR5MuLrk1cM%3D
LEGAL & GENERAL UCITS ETF PLC EUROPE EX UK EQTY UCITS ETF EUR(GBP) ACC,,https://www.charles-stanley-direct.co.uk/ViewShare?InvestmentId=TmHX%2FOZG%2FS8%3D
UBS (IRL) ETF PLC UBS S&P 500 SCD & SCRE UCITS ETF USD DIS,,https://www.charles-stanley-direct.co.uk/ViewShare?InvestmentId=jKja84Sp6Zs%3D
UBS (IRL) ETF PLC MSCI WRD SML CAP SC RES UT ETF A USD(GBP,,https://www.charles-stanley-direct.co.uk/ViewShare?InvestmentId=9oE8nGEBsU8%3D
UBS (IRL) ETF PLC UBS MSCI USA SE FC MIX UCITS ETF USD DIS,,https://www.charles-stanley-direct.co.uk/ViewShare?InvestmentId=ywJOqXoKTng%3D
LEGAL & GENERAL UCITS ETF PLC L&G ISE CYBER SECURITY GO UCITS ETF USD,,https://www.charles-stanley-direct.co.uk/ViewShare?InvestmentId=mgfFZjRx90Y%3D
LEGAL & GENERAL UCITS ETF PLC L&G ISE CYBER SECURITY GO UCITS ETF USD,,https://www.charles-stanley-direct.co.uk/ViewShare?InvestmentId=vDS0OHnVFPs%3D
LEGAL & GENERAL UCITS ETF PLC S&P 100 EQUAL WEIGHT UCITS ETF USD ACC,,https://www.charles-stanley-direct.co.uk/ViewShare?InvestmentId=6PO2foz%2FaVE%3D
XTRACKERS MSCI CHINA A UCITS ETF,,https://www.charles-stanley-direct.co.uk/ViewShare?InvestmentId=sggmiW5%2BudQ%3D
XTRACKERS MSCI CHINA A UCITS ETF,,https://www.charles-stanley-direct.co.uk/ViewShare?InvestmentId=QUmurqsu%2BVI%3D
GLOBAL X ETFS ICAV LITHIUM & BATTERY TECH UCITS ETF USD ACC,,https://www.charles-stanley-direct.co.uk/ViewShare?InvestmentId=gjjCJc%2Fs0u0%3D
VANECK UCITS ETFS PLC QUANTUM COMPUTING UC ETF A USD GBP ACC,,https://www.charles-stanley-direct.co.uk/ViewShare?InvestmentId=UYiQQe7XvXI%3D
VANECK UCITS ETFS PLC MORNINGSTAR US SMID MOAT UCITS ETF A USD,,https://www.charles-stanley-direct.co.uk/ViewShare?InvestmentId=m468rI9LVoc%3D
VANECK UCITS ETFS PLC VIDEO GAMING ESPORTS UCITS ETF A USD ACC,,https://www.charles-stanley-direct.co.uk/ViewShare?InvestmentId=eU8nUljgj%2Bw%3D
VANECK UCITS ETFS PLC MORNINGSTAR US WIDE MOAT UCITS ETF A USD,,https://www.charles-stanley-direct.co.uk/ViewShare?InvestmentId=s8tmG8b3ETE%3D
VANECK UCITS ETFS PLC VANECK VECTORS JNR GOLD MINERS UC ETF A,,https://www.charles-stanley-direct.co.uk/ViewShare?InvestmentId=HLToc1XJwls%3D
VANECK UCITS ETFS PLC MORNINGSTAR GBL WIDE MOAT UCIT ETF A USD,,https://www.charles-stanley-direct.co.uk/ViewShare?InvestmentId=eF4z7mn91RM%3D
HSBC ETFS PLC HSBC MSCI CHINA UCITS ETF A USD HGD ACC,,https://www.charles-stanley-direct.co.uk/ViewShare?InvestmentId=WB6GTjIf92s%3D
VANECK UCITS ETFS PLC VANECK VECTORS GOLD MINERS UCTS ETF A US,,https://www.charles-stanley-direct.co.uk/ViewShare?InvestmentId=a7eFjzaWg%2F8%3D
VANECK UCITS ETFS PLC VANECK VECTORS JNR GOLD MINERS UC ETF A,,https://www.charles-stanley-direct.co.uk/ViewShare?InvestmentId=SxR5svPex40%3D
LEGAL & GENERAL UCITS ETF PLC EMG MKTS CORP BD (USD) SCR UCITS ETF USD,,https://www.charles-stanley-direct.co.uk/ViewShare?InvestmentId=6d7pQtsWrps%3D
LEGAL & GENERAL UCITS ETF PLC EMG MKTS CORP BD (USD) SCR UCITS ETF GBP,,https://www.charles-stanley-direct.co.uk/ViewShare?InvestmentId=OnkUzsDi%2BOg%3D
LEGAL & GENERAL UCITS ETF PLC ASIA PAC EX JPN EQ UCITS ETF USD ACC,,https://www.charles-stanley-direct.co.uk/ViewShare?InvestmentId=pkUvnmuNW%2F0%3D
UBS (IRL) ETF PLC S&P 500 SCRD & SCR UCT ETF A GBP HGD DIS,,https://www.charles-stanley-direct.co.uk/ViewShare?InvestmentId=vvgjtEJfuVI%3D
VANECK UCITS ETFS PLC GNMCS & HLTHCR INVTRS UC ETF A GBP ACC,,https://www.charles-stanley-direct.co.uk/ViewShare?InvestmentId=7XcE06K9Bg4%3D
VANECK UCITS ETFS PLC SUST FUTURE OF FOODS UCITS ETF A GBP ACC,,https://www.charles-stanley-direct.co.uk/ViewShare?InvestmentId=Ton3zxh9ho8%3D
M&G (IRELAND) ETF ICAV M&G UK GILTS ACTV UCITS ETF STRL GBP ACC,,https://www.charles-stanley-direct.co.uk/ViewShare?InvestmentId=Bn5yx0mTjvQ%3D
VANECK UCITS ETFS PLC VNCK UC ETFS E M HY BD UC ETF A GBP ACC,,https://www.charles-stanley-direct.co.uk/ViewShare?InvestmentId=IDr08qlrcL0%3D
HANETF ICAV ETC GROUP WEB 3.0 UCITS ETF USD ACC,,https://www.charles-stanley-direct.co.uk/ViewShare?InvestmentId=fWd3eJNCZ8U%3D
HANETF ICAV ETC GROUP WEB 3.0 UCITS ETF ACC GBX,,https://www.charles-stanley-direct.co.uk/ViewShare?InvestmentId=DTYKBZyddnM%3D
ISHARES II PLC CORE UK GLTS UCITS ETF GBP DIS,,https://www.charles-stanley-direct.co.uk/ViewShare?InvestmentId=Ua7rfepyHoI%3D
ISHARES II PLC ASIA PROPERTY YIELD ETF USD DIST GBP,,https://www.charles-stanley-direct.co.uk/ViewShare?InvestmentId=Qs1CNtOnv%2Fs%3D
ISHARES II PLC US PROP YLD UCITS ETF USD DIS,,https://www.charles-stanley-direct.co.uk/ViewShare?InvestmentId=oFBAY7UX%2B6Y%3D
ISHARES II PLC USD TIPS UCITS ETF USD ACC USD,,https://www.charles-stanley-direct.co.uk/ViewShare?InvestmentId=GjGXhuqpOuM%3D
XTRACKERS MSCI AC ASIA EX JAPAN ESG SWAP UCITS ETF,,https://www.charles-stanley-direct.co.uk/ViewShare?InvestmentId=cviC0r%2FZXew%3D
ISHARES II PLC DW JNES GLB SCREENED ETF USD ACC,,https://www.charles-stanley-direct.co.uk/ViewShare?InvestmentId=KSbqDlJSdK8%3D
ISHARES VII PLC ISHARES DOW JONES IND AVERAGE UCITS ETF,,https://www.charles-stanley-direct.co.uk/ViewShare?InvestmentId=n8wWUCgQG9k%3D
VANGUARD FUNDS PLC FTSE EMERGING MARKETS UCITS ETF USD DIS,,https://www.charles-stanley-direct.co.uk/ViewShare?InvestmentId=XzDDt20qL9I%3D
VANGUARD FUNDS PLC FTSE EMERGING MARKETS UCITS ETF USD DIS,,https://www.charles-stanley-direct.co.uk/ViewShare?InvestmentId=J%2BiD88oaEIA%3D
ISHARES V PLC GERMANY GOVT BOND UCITS ETF EUR DIST,,https://www.charles-stanley-direct.co.uk/ViewShare?InvestmentId=cdbaeU0qZac%3D
ISHARES V PLC ITALY GOVT BOND UCITS ETF EUR DIST,,https://www.charles-stanley-direct.co.uk/ViewShare?InvestmentId=bPu7ogHegi4%3D
ISHARES V PLC MSCI JAPAN GBP HEDGED UCITS ETF ACC,,https://www.charles-stanley-direct.co.uk/ViewShare?InvestmentId=4Tr2gYcJCJ4%3D
VANGUARD FUNDS PLC FTSE DEVELOPED EUROPE UCITS ETF EUR DIS,,https://www.charles-stanley-direct.co.uk/ViewShare?InvestmentId=YMYeU4BS1eY%3D
ISHARES IV PLC USD ULTRASHORT BOND UCITS ETF USD DIST,,https://www.charles-stanley-direct.co.uk/ViewShare?InvestmentId=aC%2Fysten5T0%3D
ISHARES IV PLC GBP ULTRASHORT BOND UCITS ETF GBP DIST,,https://www.charles-stanley-direct.co.uk/ViewShare?InvestmentId=49JOHQtwgq8%3D
ISHARES IV PLC EUR ULTRASHORT BOND UCITS ETF EUR DIST,,https://www.charles-stanley-direct.co.uk/ViewShare?InvestmentId=s1kGo5kULN4%3D
UBS (LUX) FUND SOLUTIONS SICAV UBS M UK UCITS ETF,,https://www.charles-stanley-direct.co.uk/ViewShare?InvestmentId=KjP8%2B18DCv4%3D
ISHARES II PLC FLOATING RATE BOND UCITS ETF GBP DIS,,https://www.charles-stanley-direct.co.uk/ViewShare?InvestmentId=%2B%2FamsedvF%2Bg%3D
FIRST TRUST GLOBAL FUNDS ICAV FACTORFX UCITS ETF B GBP,,https://www.charles-stanley-direct.co.uk/ViewShare?InvestmentId=SqYaIi1zcWA%3D
MULTI UNITS LUXEMBOURG AMUNDI CORE MSCI EMU UCITS ETF DIS,,https://www.charles-stanley-direct.co.uk/ViewShare?InvestmentId=phPVd%2BDODeU%3D
WISDOMTREE ISSUER ICAV WISDOMTREE ENH COMDTY UCITS ETF USD ACC,,https://www.charles-stanley-direct.co.uk/ViewShare?InvestmentId=fNKHSHmi7VQ%3D
FIDELITY UCITS ICAV GLOBAL QUALITY INCOME UCITS ETF INC GBP,,https://www.charles-stanley-direct.co.uk/ViewShare?InvestmentId=IEeN1P52yyQ%3D
ISHARES IV PLC MSCI WORLD SRI UCITS ETF USD DIS,,https://www.charles-stanley-direct.co.uk/ViewShare?InvestmentId=vvYXUISEBws%3D
WISDOMTREE ISSUER ICAV WISDOMTREE ENH COMDTY UCITS ETF USD DIS,,https://www.charles-stanley-direct.co.uk/ViewShare?InvestmentId=pyfeQ7927EU%3D
AMUNDI INDEX SOLUTIONS AMUNDI GLOBAL LUXURY UCITS ETF USD ACC,,https://www.charles-stanley-direct.co.uk/ViewShare?InvestmentId=0I777CeitU0%3D
AMUNDI INDEX SOLUTIONS AMUNDI RUSSELL 2000 UCITS ETF USD ACC,,https://www.charles-stanley-direct.co.uk/ViewShare?InvestmentId=%2ButtOUoxCTc%3D
XTRACKERS II XTRACK II GBL GOVT BD UCITS ETF 5C,,https://www.charles-stanley-direct.co.uk/ViewShare?InvestmentId=l1N1EfeeKb4%3D
XTRACKERS II XTRACKERS II USD OVNI RATE SWA UCITS ETF,,https://www.charles-stanley-direct.co.uk/ViewShare?InvestmentId=xLMbrVkd3QY%3D
FIDELITY UCITS ICAV EUROPE QUALITY INCOME UCITS ETF EUR DIS,,https://www.charles-stanley-direct.co.uk/ViewShare?InvestmentId=C2mRmohpktc%3D
MULTI UNITS LUXEMBOURG AMUNDI UK EQUITY ALL CAP UCITS ETF,,https://www.charles-stanley-direct.co.uk/ViewShare?InvestmentId=2OdoGguRJLQ%3D
MULTI UNITS LUXEMBOURG AMUNDI CORE MSCI JAPAN UCITS ETF ACC,,https://www.charles-stanley-direct.co.uk/ViewShare?InvestmentId=VEqZgdDe8zA%3D
MULTI UNITS LUXEMBOURG AMUNDI CORE MSCI JAPAN UCITS ETF ACC,,https://www.charles-stanley-direct.co.uk/ViewShare?InvestmentId=RTvLrFhJDvo%3D
MULTI UNITS LUXEMBOURG AMUNDI EURO STOXX BANKS UCITS ETF ACC,,https://www.charles-stanley-direct.co.uk/ViewShare?InvestmentId=ojKY3P85iiw%3D
WISDOMTREE ISSUER ICAV WISDOMTREE FLTG RATE TRSY BD UCITS ETF,,https://www.charles-stanley-direct.co.uk/ViewShare?InvestmentId=nR96TmnWuQw%3D
MULTI UNITS LUXEMBOURG AMDI MSCI SMART MBLTY UCITS ETF ACC,,https://www.charles-stanley-direct.co.uk/ViewShare?InvestmentId=mI92Qk4rVxg%3D
AMUNDI INDEX SOLUTIONS CORE US TREASURY BOND UCITS ETF DIST,,https://www.charles-stanley-direct.co.uk/ViewShare?InvestmentId=rye%2FxpzY02A%3D
VANGUARD FUNDS PLC FTSE ALL WORLD UCITS ETF GBP ACC,,https://www.charles-stanley-direct.co.uk/ViewShare?InvestmentId=XRzzSaGQ9BM%3D
ISHARES II PLC MSCI USA QLTY DIV ADV UCITS ETF,,https://www.charles-stanley-direct.co.uk/ViewShare?InvestmentId=SsZFWudHKvg%3D
ISHARES II PLC MSCI USA QLTY DIV ADV UCITS ETF,,https://www.charles-stanley-direct.co.uk/ViewShare?InvestmentId=asJ5UEDAuOI%3D
XTRACKERS (IE) PLC USD CORPORATE BOND SRI PAB UCITS ETF,,https://www.charles-stanley-direct.co.uk/ViewShare?InvestmentId=VY6MpFDcB2E%3D
MULTI UNITS FRANCE AMUNDI MSCI NEW ENERGY UCITS ETF DIST,,https://www.charles-stanley-direct.co.uk/ViewShare?InvestmentId=jVEEL9m4iZA%3D
MULTI UNITS FRANCE AMUNDI MSCI NEW ENERGY UCITS ETF DIST,,https://www.charles-stanley-direct.co.uk/ViewShare?InvestmentId=FPl3Dz5IPy0%3D
XTRACKERS (IE) PLC WORLD BIODIVERSITY FOCUS SRI UCITS ETF 1,,https://www.charles-stanley-direct.co.uk/ViewShare?InvestmentId=7D5NwiVSl%2BY%3D
XTRACKERS (IE) PLC USA BIODIVERSITY FOCUS SRI UCITS ETF 1C,,https://www.charles-stanley-direct.co.uk/ViewShare?InvestmentId=BmoEER7ZeBE%3D
ISHARES IV PLC DGTL SEC UCITS ETF USD (GBP) DIS,,https://www.charles-stanley-direct.co.uk/ViewShare?InvestmentId=Bi%2BlLDUfxbk%3D
XTRACKERS (IE) PLC MSCI FINTECH INNOVATION UCITS ETF IC USD,,https://www.charles-stanley-direct.co.uk/ViewShare?InvestmentId=LwBYgPLgTzM%3D
XTRACKERS (IE) PLC MSCI WORLD UCITS ETF 1D USD (GBP),,https://www.charles-stanley-direct.co.uk/ViewShare?InvestmentId=F7LmWeaCpgg%3D
WISDOMTREE ISSUER ICAV NEW ECONOMY REAL ESTATE UCITS ETF USDACC,,https://www.charles-stanley-direct.co.uk/ViewShare?InvestmentId=JsXmts%2F%2FsfY%3D
WISDOMTREE ISSUER ICAV NEW ECONOMY REAL ESTATE UCITS ETF USD,,https://www.charles-stanley-direct.co.uk/ViewShare?InvestmentId=4xmws%2BNyLtE%3D
UBS (IRL) ETF PLC UBS MSCI UNITED KINGDOM SRI ACC,,https://www.charles-stanley-direct.co.uk/ViewShare?InvestmentId=%2BwHorHSOKKk%3D
INVESCO MARKETS PLC INVESCO ENGY S&P US SEL SEC UCIT ETF USD,,https://www.charles-stanley-direct.co.uk/ViewShare?InvestmentId=tJwkzYGN%2BwI%3D
ISHARES VII PLC ISHARES EUR GOVT BD 3-7 YR UCITS ETF EUR,,https://www.charles-stanley-direct.co.uk/ViewShare?InvestmentId=r%2FRi2ApNOJc%3D
PALMER SQUARE UCITS ICAV EUR CLO SENIOR DEBT IDX UCITS ETF EUR(GB,,https://www.charles-stanley-direct.co.uk/ViewShare?InvestmentId=zCSkyWgYABc%3D
INVESCO MARKETS II PLC MSCI ACWI ISLAMC M-SER UCITS ETF USD ACC,,https://www.charles-stanley-direct.co.uk/ViewShare?InvestmentId=fNjZNC3bVIA%3D
INVESCO MARKETS PLC INVESCO REAL EST S&P US SEL SEC UCT ETF,,https://www.charles-stanley-direct.co.uk/ViewShare?InvestmentId=K2p1N5fmoI0%3D
INVESCO MARKETS PLC INVESCO FINS S&P US SEL SEC UCIT ETF USD,,https://www.charles-stanley-direct.co.uk/ViewShare?InvestmentId=FQ2TNBgT2AI%3D
INVESCO MARKETS PLC INVESCO FINS S&P US SEL SEC UCIT ETF GBP,,https://www.charles-stanley-direct.co.uk/ViewShare?InvestmentId=g67tNQ5Z18o%3D
INVESCO MARKETS PLC INVESCO TECH S&P US SEL SEC UCIT ETF GBP,,https://www.charles-stanley-direct.co.uk/ViewShare?InvestmentId=dHd93iGSA0I%3D
VANGUARD FUNDS PLC USD CORP 1-3 YEAR BD UCITS ETF USD DIS,,https://www.charles-stanley-direct.co.uk/ViewShare?InvestmentId=v6Mz7b4C%2FpE%3D
MULTI UNITS LUXEMBOURG AMUNDI CORE S&P 500 SWAP ETF GBP HDG D,,https://www.charles-stanley-direct.co.uk/ViewShare?InvestmentId=YQ8loV8DssY%3D
FIDELITY UCITS II ICAV ESG USD EM BOND UCITS ETF USD DIS(GBP),,https://www.charles-stanley-direct.co.uk/ViewShare?InvestmentId=rOmIY5o2%2FtU%3D
AMUNDI LUXEMBOURG SA AMUNDI GLO AGGR GN BD 1-10Y UCITS ETF AC,,https://www.charles-stanley-direct.co.uk/ViewShare?InvestmentId=%2FyIwAIyiGvI%3D
ISHARES III PLC S&P 500 EQUAL WEIGHT UCITS ETF GBP ACC H,,https://www.charles-stanley-direct.co.uk/ViewShare?InvestmentId=l1CjIOovzkE%3D
INVESCO MARKETS II PLC US TREASURY BD 7-10Y UCIT ETF USD ACC,,https://www.charles-stanley-direct.co.uk/ViewShare?InvestmentId=kDThEilyHuA%3D
XTRACKERS (IE) PLC S&P 500 EQUAL WEIGHT ESG UCITS ETF 4C GB,,https://www.charles-stanley-direct.co.uk/ViewShare?InvestmentId=2iB%2FlGMGQ6I%3D
VANGUARD FUNDS PLC US TRSY 1-3 YR BD UCITS ETF USD DIS,,https://www.charles-stanley-direct.co.uk/ViewShare?InvestmentId=f78%2FT%2FDS8Nk%3D
VANGUARD FUNDS PLC US TRSY 1-3 YR BD UCITS ETF USD ACC,,https://www.charles-stanley-direct.co.uk/ViewShare?InvestmentId=7AOVCWZPFIQ%3D
VANGUARD FUNDS PLC US TRSY 3-7 YR BD UCITS ETF USD DIS,,https://www.charles-stanley-direct.co.uk/ViewShare?InvestmentId=mtpD5jm%2BZFs%3D
VANGUARD FUNDS PLC US TRSY 3-7 YR BD UCITS ETF USD ACC,,https://www.charles-stanley-direct.co.uk/ViewShare?InvestmentId=KGou8BzOtLI%3D
VANGUARD FUNDS PLC US TRSY 7-10 YR BD UCITS ETF USD DIS,,https://www.charles-stanley-direct.co.uk/ViewShare?InvestmentId=8TmurliXO%2Bw%3D
VANGUARD FUNDS PLC US TRSY 7-10 YR BD UCITS ETF USD ACC,,https://www.charles-stanley-direct.co.uk/ViewShare?InvestmentId=%2Blh66vKBz7g%3D
ISHARES VI PLC EDGE MSCI WRD MIN VOL ADV UT ETF USD ACC,,https://www.charles-stanley-direct.co.uk/ViewShare?InvestmentId=ydLYRMQXIqk%3D
ISHARES VI PLC EDGE MSCI USA MIN VOL ADV UT ETF USD ACC,,https://www.charles-stanley-direct.co.uk/ViewShare?InvestmentId=YgYisg%2FwnEI%3D
INVESCO MARKETS II PLC S&P WD ENERGY TARGETED & SCR UC ETF ACC,,https://www.charles-stanley-direct.co.uk/ViewShare?InvestmentId=eD8CpkdPLXI%3D
INVESCO MARKETS II PLC S&P WD ENERGY TARGETED & SCR UC ETF ACC,,https://www.charles-stanley-direct.co.uk/ViewShare?InvestmentId=qSeOTSiSm2A%3D
XTRACKERS II XTRACK II EURZ GOV BD 1 3 UCT ETF 2D GBP,,https://www.charles-stanley-direct.co.uk/ViewShare?InvestmentId=Os3RoHs54zU%3D
XTRACKERS II XTRACK II EURZ GOV BD 5 7 UCT ETF 1D GBP,,https://www.charles-stanley-direct.co.uk/ViewShare?InvestmentId=976IAA5CWyk%3D
PALMER SQUARE UCITS ICAV EUR CLO SENIOR DEBT IDX UCITS ETF EUR AC,,https://www.charles-stanley-direct.co.uk/ViewShare?InvestmentId=pQBCZCbZehM%3D
INVESCO MARKETS II PLC INVESCO EUR AAA CLO UCITS ETF USD HDG AC,,https://www.charles-stanley-direct.co.uk/ViewShare?InvestmentId=vXvSJ%2BY%2Bbqk%3D
UBS (LUX) FUND SOLUTIONS SICAV UBS CORE MSCI JAPAN UCITS ETF JPY ACC,,https://www.charles-stanley-direct.co.uk/ViewShare?InvestmentId=IHB7JBmb3%2Fc%3D
MULTI UNITS LUXEMBOURG AMUNDI S P 500 EQL WEIGHT S UCT ETF GBP,,https://www.charles-stanley-direct.co.uk/ViewShare?InvestmentId=DR7Tb1NPtq4%3D
INVESCO MARKETS II PLC INVESCO GBL ACT ESG EQ UCITS ETF USD ACC,,https://www.charles-stanley-direct.co.uk/ViewShare?InvestmentId=Xk1orNU7ggQ%3D
UBS (LUX) FUND SOLUTIONS SICAV UBS MSCI EMU VALUE UCITS ETF EUR DIS,,https://www.charles-stanley-direct.co.uk/ViewShare?InvestmentId=5GZKgRn2Ruk%3D
INVESCO MARKETS II PLC INVESCO USD AT1 COCO BD UCT ETF USD ACC,,https://www.charles-stanley-direct.co.uk/ViewShare?InvestmentId=489tWmTd%2FZM%3D
UBS (LUX) FUND SOLUTIONS SICAV UBS M EMU SELECT FAC MIX UCITS ETF,,https://www.charles-stanley-direct.co.uk/ViewShare?InvestmentId=2fEApgesmUo%3D
ISHARES III PLC JP MORGAN EM LOC GOV BD UCT ETF USD ACC,,https://www.charles-stanley-direct.co.uk/ViewShare?InvestmentId=Ee7xKTeYDZM%3D
VANGUARD FUNDS PLC FTSE DEV ASIA PAC EX JPN UTS ETF USD ACC,,https://www.charles-stanley-direct.co.uk/ViewShare?InvestmentId=15HM%2BjVLd%2FA%3D
VANGUARD FUNDS PLC FTSE ALL WRLD HI DIV YLD UTS ETF USD ACC,,https://www.charles-stanley-direct.co.uk/ViewShare?InvestmentId=e2w1OR0L31k%3D
VANGUARD FUNDS PLC FTSE ALL WRLD HI DIV YLD UTS ETF GBP ACC,,https://www.charles-stanley-direct.co.uk/ViewShare?InvestmentId=zfZz3jDAZh0%3D
ISHARES II PLC USD HIGH YLD CORP BD ESG UCT ETF USD ACC,,https://www.charles-stanley-direct.co.uk/ViewShare?InvestmentId=FNKYLL1KbXM%3D
INVESCO MARKETS II PLC INVESCO GBL ACT ESG EQ UCITS ETF USD ACC,,https://www.charles-stanley-direct.co.uk/ViewShare?InvestmentId=YVx7hLEM%2FGo%3D
INVESCO MARKETS II PLC INVESCO USD AT1 COCO BD UCT ETF GBP DIS,,https://www.charles-stanley-direct.co.uk/ViewShare?InvestmentId=YLcIPshGfZA%3D
INVESCO MARKETS II PLC INVESCO USD AT1 COCO BD UCT ETF GBP DIS,,https://www.charles-stanley-direct.co.uk/ViewShare?InvestmentId=sKr0oj9pGaM%3D
VANGUARD FUNDS PLC FTSE DEV ASIA PAC EX JPN UTS ETF GBP ACC,,https://www.charles-stanley-direct.co.uk/ViewShare?InvestmentId=PZZNyxRc2qQ%3D
UBS (LUX) FUND SOLUTIONS SICAV UBS MSCI CHINA UNIV UCITS ETF USD ADIS,,https://www.charles-stanley-direct.co.uk/ViewShare?InvestmentId=2w%2F%2FU%2FuDWzU%3D
AMUNDI INDEX SOLUTIONS PRIME UK MID SMALL CAP UC ETF DR GBP DIS,,https://www.charles-stanley-direct.co.uk/ViewShare?InvestmentId=J5NFzfSUH6Q%3D
UBS (LUX) FUND SOLUTIONS SICAV BBG BARCLAYS TIPS 10+ ETF A USD(GBP) ACC,,https://www.charles-stanley-direct.co.uk/ViewShare?InvestmentId=PbHfrHhKXNQ%3D
ISHARES IV PLC ISHARES MSCI US ESG EN UCIT ETF GBP H D,,https://www.charles-stanley-direct.co.uk/ViewShare?InvestmentId=yjJIiRSsbJY%3D
INVESCO MARKETS II PLC FTSE ALL SHARE ESG CLM UCITS ETF GBP ACC,,https://www.charles-stanley-direct.co.uk/ViewShare?InvestmentId=%2FEa4r%2FQvlGU%3D
ISHARES III PLC GBL INFL LNKD GVT BD UCTS ETF EUR DIS HD,,https://www.charles-stanley-direct.co.uk/ViewShare?InvestmentId=2SCszsiRl6A%3D
