name,isin,symbol,url
ARK ETF TRUST INNOVATION ETF,,0H7G,https://www.charles-stanley-direct.co.uk/ViewShare?InvestmentId=nnHCcnkhINA%3D
VANECK ETF TR VANECK AGRIBUSINESS ETF,,0LLE,https://www.charles-stanley-direct.co.uk/ViewShare?InvestmentId=SA%2B%2BB9zPxG4%3D
HSBC ETFS PLC MSCI INDONESIA UCITS ETF,,HIDR,https://www.charles-stanley-direct.co.uk/ViewShare?InvestmentId=%2FNwcPXPmiWA%3D
HSBC ETFS PLC MSCI JAPAN UCITS ETF,,HMJP,https://www.charles-stanley-direct.co.uk/ViewShare?InvestmentId=GP%2BwsPFJUkc%3D
HSBC ETFS PLC MSCI USA UCITS ETF,,HMUS,https://www.charles-stanley-direct.co.uk/ViewShare?InvestmentId=fgZO3vWZKVw%3D
HSBC ETFS PLC MSCI WORLD UCITS ETF,,HMWO,https://www.charles-stanley-direct.co.uk/ViewShare?InvestmentId=IK7OkAddGUA%3D
HSBC ETFS PLC MSCI EUROPE UCITS ETF,,HMEU,https://www.charles-stanley-direct.co.uk/ViewShare?InvestmentId=L60a7e3PPxQ%3D
HSBC ETFS PLC MSCI CANADA UCITS ETF,,HCAN,https://www.charles-stanley-direct.co.uk/ViewShare?InvestmentId=WuWwnGPXEA4%3D
HSBC ETFS PLC FTSE 250 UCITS ETF,,HMCX,https://www.charles-stanley-direct.co.uk/ViewShare?InvestmentId=NszQg0Zs8ys%3D
HSBC ETFS PLC FTSE 100 UCITS ETF,,HUKX,https://www.charles-stanley-direct.co.uk/ViewShare?InvestmentId=A9BMe%2BeBsZs%3D
HSBC ETFS PLC MSCI CHINA UCITS ETF,,HMCH,https://www.charles-stanley-direct.co.uk/ViewShare?InvestmentId=oCt2%2FN805rw%3D
HANETF ICAV SPROTT URANIUM MINERS ETF ACC ETF GBX,,URNP,https://www.charles-stanley-direct.co.uk/ViewShare?InvestmentId=4HmDoGB9OX8%3D
AMUNDI ETF ICAV CORE MSCI WORLD UCITS ETF ACC,,MWRL,https://www.charles-stanley-direct.co.uk/ViewShare?InvestmentId=kE4RdWjQd4M%3D
WAYSTONE ETF ICAV CALAMOS AUTOCALLABLE INCOME ETF USD ACC,,CAKS,https://www.charles-stanley-direct.co.uk/ViewShare?InvestmentId=YJXv46CkN1Y%3D
AMUNDI ETF ICAV CORE MSCI WORLD UCITS ETF ACC,,MWRU,https://www.charles-stanley-direct.co.uk/ViewShare?InvestmentId=nk0R7DE4mhE%3D
WAYSTONE ETF ICAV CALAMOS AUTOCALLABLE INCOME ETF USD DIS,,CAKG,https://www.charles-stanley-direct.co.uk/ViewShare?InvestmentId=BFACMBLtJAY%3D
AMUNDI ETF ICAV PRIME GLOBAL UCITS ETF USD DIST,,MWOZ,https://www.charles-stanley-direct.co.uk/ViewShare?InvestmentId=buzBPniagMM%3D
WAYSTONE ETF ICAV CALAMOS AUTOCALLABLE INCOME ETF USD DIS,,CAKD,https://www.charles-stanley-direct.co.uk/ViewShare?InvestmentId=5szk9KBLZvA%3D
WAYSTONE ETF ICAV CALAMOS AUTOCALLABLE INCOME ETF USD ACC,,CAKE,https://www.charles-stanley-direct.co.uk/ViewShare?InvestmentId=JAB0CXtMTZA%3D
LEGAL & GENERAL UCITS ETF PLC METAVERSE UCITS ETF ACCUMULATING,,MTVR,https://www.charles-stanley-direct.co.uk/ViewShare?InvestmentId=eySLD9E6ksU%3D
LEGAL & GENERAL UCITS ETF PLC METAVERSE UCITS ETF ACCUMULATING,,MTVG,https://www.charles-stanley-direct.co.uk/ViewShare?InvestmentId=oP09ATD4Qew%3D
LEGAL & GENERAL UCITS ETF PLC ARTIFICIAL INTELLIGENCE USD ETF,,AIAI,https://www.charles-stanley-direct.co.uk/ViewShare?InvestmentId=Z%2BTW6mLHG2M%3D
LEGAL & GENERAL UCITS ETF PLC ARTIFICIAL INTELLIGENCE GBP ETF,,AIAG,https://www.charles-stanley-direct.co.uk/ViewShare?InvestmentId=bMuj8vXy5rM%3D
LEGAL & GENERAL UCITS ETF PLC CLEAN ENERGY USD ETF,,RENW,https://www.charles-stanley-direct.co.uk/ViewShare?InvestmentId=S4FzA7ACnHA%3D
LEGAL & GENERAL UCITS ETF PLC CLEAN ENERGY GBP ETF,,RENG,https://www.charles-stanley-direct.co.uk/ViewShare?InvestmentId=zP%2FqqIL0RGM%3D
LEGAL & GENERAL UCITS ETF PLC CLEAN WATER USD ETF,,GLUG,https://www.charles-stanley-direct.co.uk/ViewShare?InvestmentId=1QsYd9xwC7U%3D
LEGAL & GENERAL UCITS ETF PLC CLEAN WATER GBP ETF,,GLGG,https://www.charles-stanley-direct.co.uk/ViewShare?InvestmentId=5Rsh4FkQY4o%3D
HSBC ETFS PLC S&P 500 UCITS ETF,,HSPX,https://www.charles-stanley-direct.co.uk/ViewShare?InvestmentId=w%2F%2FxsdpowgI%3D
HSBC ETFS PLC MSCI CHINA UCITS ETF USD,,HMCD,https://www.charles-stanley-direct.co.uk/ViewShare?InvestmentId=j9AYhdfmf0U%3D
HSBC ETFS PLC EURO STOXX 50 UCITS ETF,,H50E,https://www.charles-stanley-direct.co.uk/ViewShare?InvestmentId=qPmhY7Ulx9E%3D
HSBC ETFS PLC HSBC EUROPE SCREENED EQUITY ETF,,HSEU,https://www.charles-stanley-direct.co.uk/ViewShare?InvestmentId=Fs%2FCJl6sDfQ%3D
HSBC ETFS PLC HSBC EUROPE SCREENED EQUITY ETF,,HSEP,https://www.charles-stanley-direct.co.uk/ViewShare?InvestmentId=UrXRq%2BCByE8%3D
HSBC ETFS PLC MSCI EMERGING MARKETS UCITS ETF,,HMEF,https://www.charles-stanley-direct.co.uk/ViewShare?InvestmentId=sdSEsxRpjIc%3D
HSBC ETFS PLC MSCI JAPAN UCITS ETF USD,,HMJD,https://www.charles-stanley-direct.co.uk/ViewShare?InvestmentId=jGSl2hcyalc%3D
HSBC ETFS PLC MSCI CANADA UCITS ETF USD,,HCAD,https://www.charles-stanley-direct.co.uk/ViewShare?InvestmentId=YJ0SThCcdq4%3D
HSBC ETFS PLC MSCI KOREA CAPPED UCITS ETF,,HKOR,https://www.charles-stanley-direct.co.uk/ViewShare?InvestmentId=AilvdxmJais%3D
HSBC ETFS PLC MSCI USA UCITS ETF USD,,HMUD,https://www.charles-stanley-direct.co.uk/ViewShare?InvestmentId=JR3ozF3U%2BNg%3D
HSBC ETFS PLC MSCI WORLD UCITS ETF USD,,HMWD,https://www.charles-stanley-direct.co.uk/ViewShare?InvestmentId=hUcZDTjN2LQ%3D
HSBC ETFS PLC HSBC JAPAN SCREENED EQUITY ETF,,HSJP,https://www.charles-stanley-direct.co.uk/ViewShare?InvestmentId=zJycjPcwIbM%3D
HSBC ETFS PLC HSBC USA SCREENED EQUITY ETF,,HSUD,https://www.charles-stanley-direct.co.uk/ViewShare?InvestmentId=bE7JLGwfYj8%3D
HSBC ETFS PLC HSBC USA SCREENED EQUITY ETF,,HSUS,https://www.charles-stanley-direct.co.uk/ViewShare?InvestmentId=m%2B7dp4ZLTvc%3D
HSBC ETFS PLC HSBC UK SCREENED EQUITY ETF,,HSUK,https://www.charles-stanley-direct.co.uk/ViewShare?InvestmentId=b4v1GWMttyY%3D
HSBC ETFS PLC HSBC EM SCREENEED EQUITY ETF,,HSEM,https://www.charles-stanley-direct.co.uk/ViewShare?InvestmentId=yP7Vk5QkqPw%3D
HSBC ETFS PLC HSBC EM SCREENEED EQUITY ETF,,HSEF,https://www.charles-stanley-direct.co.uk/ViewShare?InvestmentId=a9egrIwIUP8%3D
VANECK UCITS ETFS PLC DEFENSE UCITS ETF A USD,,DFNS,https://www.charles-stanley-direct.co.uk/ViewShare?InvestmentId=Ca%2FVoJge0oI%3D
AMUNDI ETF ICAV AMUNDI S&P WORLD FINANCIALS SCREENED ETF,,GLFI,https://www.charles-stanley-direct.co.uk/ViewShare?InvestmentId=yVl22OKVC9A%3D
WAYSTONE ETF ICAV NORTHERN TRUST LISTED PRIV EQ UCITS ETF,,FLPE,https://www.charles-stanley-direct.co.uk/ViewShare?InvestmentId=3WCPNN%2FcRWI%3D
AMUNDI ETF ICAV RUSSELL 1000 GROWTH UCITS ETF USD(GBP) A,,MWOT,https://www.charles-stanley-direct.co.uk/ViewShare?InvestmentId=N3vOoIvdXA8%3D
UBS (IRL) ETF PLC MSCI AUSTRALIA UCITS ETF A AUD DIS,,AUAD,https://www.charles-stanley-direct.co.uk/ViewShare?InvestmentId=AsN6bo3L9gU%3D
HSBC ETFS PLC NASDAQ GLOBAL SEMICONDUCTOR UCITS ETF(GB,,HNSS,https://www.charles-stanley-direct.co.uk/ViewShare?InvestmentId=QcYYKaFUNwc%3D
XTRACKERS MSCI JAPAN UCITS ETF 1C,,XMJD,https://www.charles-stanley-direct.co.uk/ViewShare?InvestmentId=yzG4Y8lMvP8%3D
XTRACKERS MSCI TAIWAN UCITS ETF 1C,,XMTD,https://www.charles-stanley-direct.co.uk/ViewShare?InvestmentId=73PPF6Q0%2BdY%3D
XTRACKERS MSCI BRAZIL UCITS ETF 1C,,XMBD,https://www.charles-stanley-direct.co.uk/ViewShare?InvestmentId=eKsJ9jYKHfY%3D
XTRACKERS MSCI EURO UCITS ETF 1C,,XMED,https://www.charles-stanley-direct.co.uk/ViewShare?InvestmentId=6%2BFt1uK9KQk%3D
XTRACKERS MSCI KOREA UCITS ETF 1C,,XKS2,https://www.charles-stanley-direct.co.uk/ViewShare?InvestmentId=ab%2Bt%2BoYfwXE%3D
XTRACKERS MSCI KOREA UCITS ETF 1C,,XKSD,https://www.charles-stanley-direct.co.uk/ViewShare?InvestmentId=Cye8G7ZE11U%3D
XTRACKERS CSI500 SWAP UCITS ETF 1C,,XCSI,https://www.charles-stanley-direct.co.uk/ViewShare?InvestmentId=yrht3cN6b1U%3D
ISHARES TRUST US AEROSPACE & DEFENSE ETF,,0JJD,https://www.charles-stanley-direct.co.uk/ViewShare?InvestmentId=oNaeK1ryDZ8%3D
XTRACKERS NIFTY 50 UCITS ETF - 1C,,XNID,https://www.charles-stanley-direct.co.uk/ViewShare?InvestmentId=4OcTqLxAgDY%3D
SSGA SPDR ETFS EUROPE I PLC SS SPDR S&P 500 UCITS ETF,,SPX5,https://www.charles-stanley-direct.co.uk/ViewShare?InvestmentId=htzMjweXdoc%3D
JPMORGAN ETFS (IRELAND) ICAV BETABUILD UK GLT 1-5YR UCITS ETF GBP INC,,JG15,https://www.charles-stanley-direct.co.uk/ViewShare?InvestmentId=%2B4w4Asdo7HU%3D
GLOBAL X ETFS ICAV GLOBAL X S&P 500 COVERED CALL UCITS ETF,,XYLU,https://www.charles-stanley-direct.co.uk/ViewShare?InvestmentId=je%2FyBCgmf%2F0%3D
GLOBAL X ETFS ICAV GLOBAL X S&P 500 COVERED CALL UCITS ETF,,XYLP,https://www.charles-stanley-direct.co.uk/ViewShare?InvestmentId=kN8pNZPU5Bs%3D
GLOBAL X ETFS ICAV S&P 500 ANNUAL BUFFER UCITS ETF USD ACC,,SPAB,https://www.charles-stanley-direct.co.uk/ViewShare?InvestmentId=quQ0PKmQEuQ%3D
GLOBAL X ETFS ICAV S&P 500 ANNUAL BUFFER UCITS ETF USD (GBP,,SABP,https://www.charles-stanley-direct.co.uk/ViewShare?InvestmentId=WCuTBCpDOSI%3D
SSGA SPDR ETFS EUROPE I PLC SS SPDR S&P 500 UCITS ETF,,SPY5,https://www.charles-stanley-direct.co.uk/ViewShare?InvestmentId=9X2K4TkvWxc%3D
JPMORGAN ETFS (IRELAND) ICAV BETABUILD US TREASURY BD 0-3 ETF USD ACC,,BB3M,https://www.charles-stanley-direct.co.uk/ViewShare?InvestmentId=3Xy7b3FTgWw%3D
JPMORGAN ETFS (IRELAND) ICAV BETABUILD US TREASURY BD 0-3 ETF GBP ACC,,BBM3,https://www.charles-stanley-direct.co.uk/ViewShare?InvestmentId=jgW35HYC8UM%3D
GLOBAL X ETFS ICAV S&P ANNUAL TAIL HEDGE UCITS ETF USD ACC,,SPAH,https://www.charles-stanley-direct.co.uk/ViewShare?InvestmentId=hM39PYPJX%2B4%3D
GLOBAL X ETFS ICAV S&P ANNUAL TAIL HEDGE UCITS ETF USD (GBP,,SAHP,https://www.charles-stanley-direct.co.uk/ViewShare?InvestmentId=VROkC2%2BWldM%3D
SSGA SPDR ETFS EUROPE II PLC SPDR MSCI EUROPE MATERIALS UCITS ETF(EUR,,MTRL,https://www.charles-stanley-direct.co.uk/ViewShare?InvestmentId=p%2BMXL8ih6zk%3D
SSGA SPDR ETFS EUROPE I PLC SPDR BLOOMBERG 3-7 YR UCITS ETF,,TRS5,https://www.charles-stanley-direct.co.uk/ViewShare?InvestmentId=715UAq%2BmWe4%3D
M&G (IRELAND) ETF ICAV M&G UK IDX LKD G AC UCITS ETF ST GBP ACC,,MUKL,https://www.charles-stanley-direct.co.uk/ViewShare?InvestmentId=CBVnbCUjW6o%3D
SSGA SPDR ETFS EUROPE I PLC SPDR MSCI EM ASIA UCITS ETF USD,,EMAD,https://www.charles-stanley-direct.co.uk/ViewShare?InvestmentId=cROprXXuAk0%3D
SSGA SPDR ETFS EUROPE I PLC SPDR MSCI EMG MARKETS UCITS ETF USD,,EMRD,https://www.charles-stanley-direct.co.uk/ViewShare?InvestmentId=JYF1Bfp0vFM%3D
PIMCO ETFS PLC ADVT US SHT TRM HGH YLD CORP BD UCT ETF,,STEA,https://www.charles-stanley-direct.co.uk/ViewShare?InvestmentId=gPojcM7bA%2F0%3D
PIMCO ETFS PLC ADVT US SHT TRM HGH YLD CORP BD UCT ETF,,STHE,https://www.charles-stanley-direct.co.uk/ViewShare?InvestmentId=OXNwxlEx%2Bn0%3D
SSGA SPDR ETFS EUROPE II PLC MSCI WORLD VALUE UCITS ETF USD ACC,,WVAL,https://www.charles-stanley-direct.co.uk/ViewShare?InvestmentId=4AcKtd3ciPk%3D
SSGA SPDR ETFS EUROPE II PLC MSCI WORLD VALUE UCITS ETF GBP ACC,,VALW,https://www.charles-stanley-direct.co.uk/ViewShare?InvestmentId=ugDoCaOHv2g%3D
JPMORGAN ETFS (IRELAND) ICAV CARBON TRNS GBL EQTY CTB UCT ETF USD ACC,,JPTC,https://www.charles-stanley-direct.co.uk/ViewShare?InvestmentId=gQeWHWx4Ppk%3D
JPMORGAN ETFS (IRELAND) ICAV CARBON TRNS GBL EQTY CTB UCT ETF USD ACC,,JPCT,https://www.charles-stanley-direct.co.uk/ViewShare?InvestmentId=UnJlAxP%2BGTQ%3D
JPMORGAN ETFS (IRELAND) ICAV GLOBAL HIGH YIELD CORP BD MF UCITS ETF U,,JGHD,https://www.charles-stanley-direct.co.uk/ViewShare?InvestmentId=zA%2F908I%2BOvA%3D
JPMORGAN ETFS (IRELAND) ICAV JPM GLOBAL REI SRI PA UCITS ETF USD DIS,,JSGD,https://www.charles-stanley-direct.co.uk/ViewShare?InvestmentId=d%2FL7%2FI8S8cQ%3D
JPMORGAN ETFS (IRELAND) ICAV JPM GLOBAL REI SRI PA UCITS ETF USD ACC,,JSEG,https://www.charles-stanley-direct.co.uk/ViewShare?InvestmentId=8krQMwFBSkg%3D
JPMORGAN ETFS (IRELAND) ICAV JPM US REI SRI PA UCITS ETF USD ACC,,JSUE,https://www.charles-stanley-direct.co.uk/ViewShare?InvestmentId=rhiaNy13K%2FQ%3D
SSGA SPDR ETFS EUROPE I PLC SS SPDR BLOOM US TREAS BOND ETF,,USTY,https://www.charles-stanley-direct.co.uk/ViewShare?InvestmentId=4E2XAfZWQ6U%3D
SSGA SPDR ETFS EUROPE II PLC SPDR MSCI EUROPE ENERGY UCITS ETF (GBP),,ENGE,https://www.charles-stanley-direct.co.uk/ViewShare?InvestmentId=TkUZYk0JJV8%3D
JPMORGAN ETFS (IRELAND) ICAV JPM US REI SRI PA UCITS ETF USD ACC,,JSEU,https://www.charles-stanley-direct.co.uk/ViewShare?InvestmentId=%2F6KoS%2B6bSjs%3D
HSBC ETFS PLC HSBC APAC EX JP SCR EQ UC ETF USD (DIST),,HSAS,https://www.charles-stanley-direct.co.uk/ViewShare?InvestmentId=oBw8VxxQwfs%3D
PIMCO ETFS PLC ADVT US SHT TRM HGH YLD CORP BD UCT ETF,,STHY,https://www.charles-stanley-direct.co.uk/ViewShare?InvestmentId=OdAgLXv1Ix8%3D
PIMCO ETFS PLC ADVT US SHT TRM HGH YLD CORP BD UCT ETF,,SSHY,https://www.charles-stanley-direct.co.uk/ViewShare?InvestmentId=owTY8U8C%2Bz8%3D
SSGA SPDR ETFS EUROPE I PLC SPDR BLOOMBERG GBL AGGR BOND UCITS ETF,,GLAG,https://www.charles-stanley-direct.co.uk/ViewShare?InvestmentId=NWp0UCixN2A%3D
SSGA SPDR ETFS EUROPE I PLC SS SPDR BLOOM US TREAS BOND ETF,,TRSY,https://www.charles-stanley-direct.co.uk/ViewShare?InvestmentId=hbSry9DZrRg%3D
JPMORGAN ETFS (IRELAND) ICAV BETABUILDERS US TY BD UT ETF GBP HDG ACC,,BBTP,https://www.charles-stanley-direct.co.uk/ViewShare?InvestmentId=B6vhzX9WrV0%3D
SSGA SPDR ETFS EUROPE I PLC SPDR BLOOMBERG GBL AGGR BOND UCITS ETF,,GLAD,https://www.charles-stanley-direct.co.uk/ViewShare?InvestmentId=%2BaznSF4sa9U%3D
JPMORGAN ETFS (IRELAND) ICAV GBL HIG YD COR BD M.FTR ACT UCITS ETF,,JGYH,https://www.charles-stanley-direct.co.uk/ViewShare?InvestmentId=DTyPBHXU1LU%3D
JPMORGAN ETFS (IRELAND) ICAV GBL HIG YD COR BD M.FTR ACT UCITS ETF,,JGHY,https://www.charles-stanley-direct.co.uk/ViewShare?InvestmentId=1kHZKnFjGaw%3D
JPMORGAN ETFS (IRELAND) ICAV JPM JAPAN RES ENH IDX EQ ACTV UCT ETF,,JREJ,https://www.charles-stanley-direct.co.uk/ViewShare?InvestmentId=lGQfxNk6l8g%3D
JPMORGAN ETFS (IRELAND) ICAV JPM JAPAN RES ENH IDX EQ ACTV UCT ETF,,JRJE,https://www.charles-stanley-direct.co.uk/ViewShare?InvestmentId=5blcfgjLzKM%3D
JPMORGAN ETFS (IRELAND) ICAV JPM GLOBAL REI SRI PA UCITS ETF USD ACC,,JSGE,https://www.charles-stanley-direct.co.uk/ViewShare?InvestmentId=5QeBNVlcAtg%3D
MULTI UNITS LUXEMBOURG AMUNDI MSCI MILENNIALS UCITS ETF ACC,,GENY,https://www.charles-stanley-direct.co.uk/ViewShare?InvestmentId=VIk38RAi5QY%3D
JANUS HENDERSON ICAV JH MBS ACTIVE ETF USD D,,JMBD,https://www.charles-stanley-direct.co.uk/ViewShare?InvestmentId=jkLeSDzBbU0%3D
XTRACKERS II US TREASURIES UCITS ETF 1C USD ACC,,XUST,https://www.charles-stanley-direct.co.uk/ViewShare?InvestmentId=0v3gtSpPnJA%3D
MULTI UNITS FRANCE AMUNDI FTSE MIB UCITS ETF DIST,,MIBX,https://www.charles-stanley-direct.co.uk/ViewShare?InvestmentId=jTSupaPvBsE%3D
FRANKLIN TEMPLETON ICAV FRK MSCI CH PARIS UCITS ETF,,CHPA,https://www.charles-stanley-direct.co.uk/ViewShare?InvestmentId=hyCUniSpetM%3D
FRANKLIN TEMPLETON ICAV FRK MSCI EM PARIS UCITS ETF,,EMPR,https://www.charles-stanley-direct.co.uk/ViewShare?InvestmentId=WDhc21bPOM0%3D
FRANKLIN TEMPLETON ICAV FRK MSCI EM PARIS UCITS ETF,,PABE,https://www.charles-stanley-direct.co.uk/ViewShare?InvestmentId=sg5uk9qpKNk%3D
XTRACKERS (IE) PLC MSCI USA POSITIONING SCREENED UCITS ETF,,XUCA,https://www.charles-stanley-direct.co.uk/ViewShare?InvestmentId=d0devXCEB9M%3D
ISHARES IV PLC ISHRS MSCI EUMC EQW UCTS ETF,,IEFS,https://www.charles-stanley-direct.co.uk/ViewShare?InvestmentId=ZmX5LHkhu8A%3D
HANETF ICAV SPROTT JUNIOR URANIUM MINERS UCITS ETF U,,URNJ,https://www.charles-stanley-direct.co.uk/ViewShare?InvestmentId=dIsLL7pCjk0%3D
HANETF ICAV SPROTT JUNIOR URANIUM MINERS UCITS ETF U,,URJP,https://www.charles-stanley-direct.co.uk/ViewShare?InvestmentId=NV6aGbogcHE%3D
XTRACKERS (IE) PLC X FTSE ALL WORLD ETF 1C,,ALLW,https://www.charles-stanley-direct.co.uk/ViewShare?InvestmentId=D%2BXMK6eXKNs%3D
XTRACKERS (IE) PLC MSCI WLD QTY UCITS ETF 1C,,XDEQ,https://www.charles-stanley-direct.co.uk/ViewShare?InvestmentId=Mn6o86DJtLY%3D
XTRACKERS (IE) PLC MSCI WLD VALUE UCITS ETF 1C,,XDEV,https://www.charles-stanley-direct.co.uk/ViewShare?InvestmentId=IXAXyy8IBhk%3D
XTRACKERS (IE) PLC MSCI WLD MOMENTUM UCITS ETF 1C,,XDEM,https://www.charles-stanley-direct.co.uk/ViewShare?InvestmentId=n9e1K4Y%2BHC0%3D
ISHARES IV PLC MSCI GLOBAL SEMICONDUCTORS UCITS ETF USD,,SEMI,https://www.charles-stanley-direct.co.uk/ViewShare?InvestmentId=6BJVK8UzLPo%3D
AMUNDI INDEX SOLUTIONS PRIME EMERGING MKTS UCITS ETF USD,,PRAN,https://www.charles-stanley-direct.co.uk/ViewShare?InvestmentId=Rvl1DNxZyF4%3D
FRANKLIN TEMPLETON ICAV EURO IG CORPORATE UCITS ETF EUR,,EURO,https://www.charles-stanley-direct.co.uk/ViewShare?InvestmentId=Z2bfuW5ALM0%3D
HANETF ICAV JURY GLOBAL HIGH DIVIDEND UCITS ETF USD,,JURY,https://www.charles-stanley-direct.co.uk/ViewShare?InvestmentId=deJGpHtl29k%3D
HANETF ICAV JURY GLOBAL HIGH DIVIDEND UCITS ETF GBX,,JURP,https://www.charles-stanley-direct.co.uk/ViewShare?InvestmentId=S2Ato1Nb3zM%3D
WISDOMTREE ISSUER ICAV EUROPE DEFENCE UCITS ETF EUR ACC,,WDEF,https://www.charles-stanley-direct.co.uk/ViewShare?InvestmentId=TOp0JjZoVC8%3D
WISDOMTREE ISSUER ICAV EUROPE DEFENCE UCITS ETF EUR ACC,,WDEP,https://www.charles-stanley-direct.co.uk/ViewShare?InvestmentId=ijaxQJ7YEiw%3D
HANETF ICAV LLOYD GROWTH EQUITY UCITS ETF USD ACC,,GEP,https://www.charles-stanley-direct.co.uk/ViewShare?InvestmentId=RjjXSF8N2c8%3D
FRANKLIN TEMPLETON ICAV FRANKLIN FTSE DEVELOPED WORLD UCITS ETF,,DWLD,https://www.charles-stanley-direct.co.uk/ViewShare?InvestmentId=xZB29NOXokA%3D
AB SICAV I EURO CORPORATE BOND PORTFOLIO UCITS ETF,,EBND,https://www.charles-stanley-direct.co.uk/ViewShare?InvestmentId=dGqVgAKyjSU%3D
WISDOMTREE ISSUER ICAV STRATEGIC METALS UCITS ETF USD ACC,,WENU,https://www.charles-stanley-direct.co.uk/ViewShare?InvestmentId=bkGZwnOuI5Q%3D
WISDOMTREE ISSUER ICAV QUANTUM COMPUTING UCITS ETF USD ACC,,WQTM,https://www.charles-stanley-direct.co.uk/ViewShare?InvestmentId=3nbwGyICY18%3D
MULTI UNITS LUXEMBOURG AMUNDI MSCI CHINA UCITS ETF ACC,,LCCG,https://www.charles-stanley-direct.co.uk/ViewShare?InvestmentId=6RWqhzXvujI%3D
BNP PARIBAS EASY ICAV ALPHA ENHNCD WRLD UCITS ETF,,QGGB,https://www.charles-stanley-direct.co.uk/ViewShare?InvestmentId=dxQY3OHBGG0%3D
XTRACKERS II HARVEST CHINA GOVT BD UCITS ETF 1D,,CGB,https://www.charles-stanley-direct.co.uk/ViewShare?InvestmentId=w8A6YAmGQlY%3D
HANETF ICAV EMQQ EMG MARKETS INTERNET UCITS ETF ACC,,EMQP,https://www.charles-stanley-direct.co.uk/ViewShare?InvestmentId=9SD7CGNJ59Q%3D
ISHARES IV PLC MSCI INDIA UCITS ETF GBP ACC,,NDIA,https://www.charles-stanley-direct.co.uk/ViewShare?InvestmentId=Rq83neG5pfM%3D
AB SICAV I USD CORPORATE BOND PORTFOLIO UCITS ETF,,EYEG,https://www.charles-stanley-direct.co.uk/ViewShare?InvestmentId=iHOpgzKV3VI%3D
ISHARES GLOBAL HIGH YIELD CORP BD UCITS ETF USD,,HYLH,https://www.charles-stanley-direct.co.uk/ViewShare?InvestmentId=CTxGX6n7HOU%3D
FRANKLIN TEMPLETON ICAV FRANKLIN EM MULTIFACTOR EQUITY UCITS ETF,,FLXE,https://www.charles-stanley-direct.co.uk/ViewShare?InvestmentId=bukIJE4ilU0%3D
XTRACKERS (IE) PLC MSCI INNOVATION UCITS ETF IC USD,,XNNV,https://www.charles-stanley-direct.co.uk/ViewShare?InvestmentId=2E4xxsICmp4%3D
WISDOMTREE ISSUER ICAV US QUALITY DIVIDEND GROWTH UCITS ETF,,DGRB,https://www.charles-stanley-direct.co.uk/ViewShare?InvestmentId=NanBBVlihKg%3D
HANETF ICAV JUPITER ORIGIN GLOBAL SML COMP ETF USD,,JOGS,https://www.charles-stanley-direct.co.uk/ViewShare?InvestmentId=Zv7dZ28iAPQ%3D
HANETF ICAV JUPITER ORIGIN GLOBAL SML COMP ETF GBX,,JOGP,https://www.charles-stanley-direct.co.uk/ViewShare?InvestmentId=8jDtikUzD%2Fo%3D
WISDOMTREE ISSUER ICAV MEGATRENDS UCITS ETF USD (GBP) ACC,,WMGG,https://www.charles-stanley-direct.co.uk/ViewShare?InvestmentId=FP1X9Ohfy98%3D
JANUS HENDERSON ICAV JH GCC USD BOND ETF GBPHD,,TGGD,https://www.charles-stanley-direct.co.uk/ViewShare?InvestmentId=OF%2BauvDQOtw%3D
ISHARES III PLC AI INFRASTRUCTURE UCITS ETF USD ACC,,AINF,https://www.charles-stanley-direct.co.uk/ViewShare?InvestmentId=0jXayIpdgnA%3D
ISHARES IV PLC ESSENTIAL METALS PRODUCERS UCITS ETF USD,,METG,https://www.charles-stanley-direct.co.uk/ViewShare?InvestmentId=DK6XpEP%2BylQ%3D
XTRACKERS II US TREASURIES 10+ UCITS ETF 1D USD,,XUTL,https://www.charles-stanley-direct.co.uk/ViewShare?InvestmentId=1eZ9bzkPG3o%3D
HANETF ICAV AMERANT LATIN AMERICAN DEBT UCITS ETF US,,RNTA,https://www.charles-stanley-direct.co.uk/ViewShare?InvestmentId=zeH36s0Zd90%3D
ISHARES V PLC EUROPE DEFENCE UCITS ETF GBP ACC,,DFEU,https://www.charles-stanley-direct.co.uk/ViewShare?InvestmentId=9qxblQ8kR3A%3D
XTRACKERS WLD SMALL CAP GREEN TECH INNO UCITS ETF,,GTIS,https://www.charles-stanley-direct.co.uk/ViewShare?InvestmentId=TtYGBBI6Us4%3D
ISHARES IV PLC ISHARES QUANTUM COMPUTING UCITS ETF USD,,QANT,https://www.charles-stanley-direct.co.uk/ViewShare?InvestmentId=3qmTNy%2B7Bkk%3D
XTRACKERS (IE) PLC MSCI WORLD UCITS ETF 1D USD,,XDWL,https://www.charles-stanley-direct.co.uk/ViewShare?InvestmentId=BggpnWuRUDc%3D
AB SICAV I GLOBAL CORP BOND PORTFOLIO UCITS ETF,,GLIS,https://www.charles-stanley-direct.co.uk/ViewShare?InvestmentId=fj3YX5uzWM4%3D
FIRST TRUST GLOBAL FUNDS ICAV US EQUITY OPPORTUNITIES UCITS A ETF,,FPX,https://www.charles-stanley-direct.co.uk/ViewShare?InvestmentId=EzkfafxXv%2BM%3D
WISDOMTREE ISSUER ICAV WT EU INFRASTRUCTURE UCITS ETF - EUR ACC,,WBLD,https://www.charles-stanley-direct.co.uk/ViewShare?InvestmentId=IfTHoI31q%2Bc%3D
AMUNDI INDEX SOLUTIONS CORE MSCI CHINA A SWAP ETF USD DIS,,MSCW,https://www.charles-stanley-direct.co.uk/ViewShare?InvestmentId=TvrSpNPwqGU%3D
WISDOMTREE ISSUER ICAV WT GLOBAL VALUE UCITS ETF - USD ACC,,WTVG,https://www.charles-stanley-direct.co.uk/ViewShare?InvestmentId=zM%2FxSE7WUNM%3D
WISDOMTREE ISSUER ICAV WT EUROPE VALUE UCITS ETF - EUR ACC,,WTVE,https://www.charles-stanley-direct.co.uk/ViewShare?InvestmentId=6kzMiXtwo%2FA%3D
WISDOMTREE ISSUER ICAV WT EUROPE VALUE UCITS ETF - EUR ACC,,VLUE,https://www.charles-stanley-direct.co.uk/ViewShare?InvestmentId=mo%2BU6bi5hPQ%3D
WISDOMTREE ISSUER ICAV WT US VALUE UCITS ETF - USD ACC,,WTVU,https://www.charles-stanley-direct.co.uk/ViewShare?InvestmentId=2CUYM9czgvU%3D
WISDOMTREE ISSUER ICAV WT US VALUE UCITS ETF - USD ACC,,VLUA,https://www.charles-stanley-direct.co.uk/ViewShare?InvestmentId=WxKxeEaPtQs%3D
LEGAL & GENERAL UCITS ETF PLC MULTI STRATEGY ENHANCED COMMODITIES UCIT,,ECGD,https://www.charles-stanley-direct.co.uk/ViewShare?InvestmentId=uAkO58XxQJg%3D
ARK INVEST UCITS ICAV SPACE & DEFENCE INNOVATION UCITS ETF USD,,ARKX,https://www.charles-stanley-direct.co.uk/ViewShare?InvestmentId=NANRRFh%2By6g%3D
ARK INVEST UCITS ICAV SPACE & DEFENCE INNOVATION UCITS ETF USD,,ARCX,https://www.charles-stanley-direct.co.uk/ViewShare?InvestmentId=XvH%2FvwyNNaA%3D
FIRST TRUST GLOBAL FUNDS ICAV US MOMENTUM UCITS ETF A USD,,FTMO,https://www.charles-stanley-direct.co.uk/ViewShare?InvestmentId=X3LfgsssMzM%3D
WISDOMTREE ISSUER ICAV WT ASIA DEFENCE UCITS ETF - USD ACC,,WDAF,https://www.charles-stanley-direct.co.uk/ViewShare?InvestmentId=W9W9e%2FYMhpE%3D
WISDOMTREE ISSUER ICAV WT TECH MEGATRENDS UCITS ETF - USD ACC,,TMGT,https://www.charles-stanley-direct.co.uk/ViewShare?InvestmentId=2TsE8kklMF4%3D
WISDOMTREE ISSUER ICAV WT ASIA DEFENCE UCITS ETF - USD ACC,,WDAP,https://www.charles-stanley-direct.co.uk/ViewShare?InvestmentId=Cd2O48nknXU%3D
MULTI UNITS LUXEMBOURG AMUNDI CORE UK GOVERNMENT ETF USD H A,,GILH,https://www.charles-stanley-direct.co.uk/ViewShare?InvestmentId=ggeWkeO030o%3D
WISDOMTREE ISSUER ICAV WT GLOBAL DEFENCE UCITS ETF - USD ACC,,WDGF,https://www.charles-stanley-direct.co.uk/ViewShare?InvestmentId=RtlhcpPwCgE%3D
WISDOMTREE ISSUER ICAV WT GLOBAL DEFENCE UCITS ETF - USD ACC,,WDFG,https://www.charles-stanley-direct.co.uk/ViewShare?InvestmentId=LnUhcbxRo50%3D
BNP PARIBAS EASY SICAV BLOOMBERG EUROPE DEFENSE UCITS ETF EUR A,,GUAR,https://www.charles-stanley-direct.co.uk/ViewShare?InvestmentId=bxhItFxQki4%3D
ISHARES II PLC ISHARES UK FOR FOCUS UCITS ETF GBP ACC,,KFOR,https://www.charles-stanley-direct.co.uk/ViewShare?InvestmentId=MwZaTV%2FYlgE%3D
LEGAL & GENERAL UCITS ETF PLC MULTI STRATEGY ENHANCED COMMODITIES UCIT,,ENCD,https://www.charles-stanley-direct.co.uk/ViewShare?InvestmentId=1xaemHFzs7Q%3D
AMUNDI LUXEMBOURG SA MSCI CHINA A II UCITS ETF USD DIST,,C024,https://www.charles-stanley-direct.co.uk/ViewShare?InvestmentId=hvv2Jg7jLtg%3D
WISDOMTREE ISSUER ICAV WT STRAT METALS UCITS ETF - GBP HEDGED,,WENP,https://www.charles-stanley-direct.co.uk/ViewShare?InvestmentId=SCQrwgbx3mc%3D
UBS (IRL) ETF PLC MSCI USA UCITS A GBP HDGD ACC,,UB0A,https://www.charles-stanley-direct.co.uk/ViewShare?InvestmentId=R3MF4p396Qc%3D
INVESCO MARKETS II PLC INVESCO PREFERRED SHARES UCITS ETF A USD,,PRFD,https://www.charles-stanley-direct.co.uk/ViewShare?InvestmentId=G9CBgjUFhtg%3D
ISHARES V PLC S&P500 MATERIALS SECTOR UCITS ETF USD(GB,,IMSU,https://www.charles-stanley-direct.co.uk/ViewShare?InvestmentId=gQF5jfF2BsI%3D
ISHARES VII PLC S&P 500 UCITS ETF GBP-H DIST,,GSPX,https://www.charles-stanley-direct.co.uk/ViewShare?InvestmentId=nUmQttbof6o%3D
ISHARES V PLC S&P500 UTILITIES SECTOR UCITS ETF USD(GB,,IUSU,https://www.charles-stanley-direct.co.uk/ViewShare?InvestmentId=F%2F35c7JfIOY%3D
ISHARES V PLC S&P500 INDUSTRIALS SECTOR UCIT ETF USD(G,,IISU,https://www.charles-stanley-direct.co.uk/ViewShare?InvestmentId=vjTEoGAEGf4%3D
INVESCO MARKETS PLC NASDAQ-100 SWAP UCITS ETF USD(GBP) ACC,,EQSG,https://www.charles-stanley-direct.co.uk/ViewShare?InvestmentId=EJNiqZwAxPE%3D
ISHARES III PLC UK GILTS 0-5YR UCITS ETF GBP DIST,,IGLS,https://www.charles-stanley-direct.co.uk/ViewShare?InvestmentId=1h3SrgQgnuM%3D
ISHARES VII PLC ISHARES CORE MSCI PAC EX-JPN UCITS ETF,,CPXJ,https://www.charles-stanley-direct.co.uk/ViewShare?InvestmentId=mF9PugM%2FCiA%3D
ISHARES V PLC S&P 500COMUNICTION SCTR UCIT ETF USD ACC,,IUCM,https://www.charles-stanley-direct.co.uk/ViewShare?InvestmentId=Q6I%2B8Cr0a9k%3D
ISHARES USD TREASURY BD 1-3 YR UCITS ETF GBP DIS,,IBTG,https://www.charles-stanley-direct.co.uk/ViewShare?InvestmentId=lRTIoKf9Pqc%3D
MULTI UNITS LUXEMBOURG AMUNDI US TREASURY BOND 7-10Y UCITS ETF,,U71G,https://www.charles-stanley-direct.co.uk/ViewShare?InvestmentId=ftwGFsQCPkM%3D
