name,isin,symbol,url
XTRACKERS (IE) PLC S&P GLOBAL INFRASTRUCTURE UCITS ETF 1C U,,XIFE,https://www.charles-stanley-direct.co.uk/ViewShare?InvestmentId=VQrls%2BYxurg%3D
ISHARES VI PLC GLBL AAA-AA GVT BND ETF USD ACC,,GAAA,https://www.charles-stanley-direct.co.uk/ViewShare?InvestmentId=1JUnUzzBT%2Bk%3D
FRANKLIN TEMPLETON ICAV FTSE EMERGING EX CHINA UCITS ETF USD(GBP,,EEXC,https://www.charles-stanley-direct.co.uk/ViewShare?InvestmentId=zbLYHnurD%2B8%3D
FRANKLIN TEMPLETON ICAV S&P WORLD SCREENED UCITS ETF USD ACC,,SPWR,https://www.charles-stanley-direct.co.uk/ViewShare?InvestmentId=8oSvwR5Ib9k%3D
FRANKLIN TEMPLETON ICAV S&P 500 SCREENED UCITS ETF USD ACC,,SP5S,https://www.charles-stanley-direct.co.uk/ViewShare?InvestmentId=TeL1w327SjM%3D
ISHARES VI PLC MSCI EM SWAP UCITS ETF USD(GBP) ACC,,ESWP,https://www.charles-stanley-direct.co.uk/ViewShare?InvestmentId=hIcn9lE3F58%3D
AMUNDI INDEX SOLUTIONS GLOBAL EX-US GOVERNMENT BOND UCITS ETF U,,GXUH,https://www.charles-stanley-direct.co.uk/ViewShare?InvestmentId=ZNuj0dEEYQE%3D
XTRACKERS (IE) PLC S&P GLOBAL INFRASTRUCTURE UCITS ETF 1C U,,XINF,https://www.charles-stanley-direct.co.uk/ViewShare?InvestmentId=ML9%2Fe2mUry0%3D
ISHARES III PLC BROAD GLOBAL GOVT BOND UCITS ETF USD(GBP,,IGBG,https://www.charles-stanley-direct.co.uk/ViewShare?InvestmentId=8al70RAeNRw%3D
ISHARES II PLC TREASURY BD 7 10YR UCITS ETF USD DIS,,IDTM,https://www.charles-stanley-direct.co.uk/ViewShare?InvestmentId=jLzP7nMaOpU%3D
OSSIAM LUX OSSIAM STOXX EURP 600 ESG EQL WGT NR ETF,,S6EW,https://www.charles-stanley-direct.co.uk/ViewShare?InvestmentId=hxBFVorbf34%3D
ISHARES VII PLC ISHARES CORE EURO STOXX 50 UCITS ETF EUR,,CSX5,https://www.charles-stanley-direct.co.uk/ViewShare?InvestmentId=dYkXDMT6wh0%3D
ISHARES VII PLC ISHARES MSCI EM ASIA UCITS ETF USD (ACC),,CEA1,https://www.charles-stanley-direct.co.uk/ViewShare?InvestmentId=joMru68XOU4%3D
UBS (LUX) FUND SOLUTIONS SICAV UBS CORE M EMU UCITS ETF,,UB06,https://www.charles-stanley-direct.co.uk/ViewShare?InvestmentId=2DJswa7Xg%2Fw%3D
UBS (LUX) FUND SOLUTIONS SICAV UBS CORE M EM UCITS ETF,,UB30,https://www.charles-stanley-direct.co.uk/ViewShare?InvestmentId=xX3vqD2%2FBfY%3D
XTRACKERS (IE) PLC USD HIGH YIELD CORP BD UCITS ETF 1D,,XUHY,https://www.charles-stanley-direct.co.uk/ViewShare?InvestmentId=ec%2BSbS%2FIqRw%3D
FIDELITY UCITS ICAV EUROPE QLTY INC UCTS ETF GBP ACC HDG,,FEQP,https://www.charles-stanley-direct.co.uk/ViewShare?InvestmentId=HHZVpiBXYBY%3D
INVESCO MARKETS II PLC FTSE ALL-WORLD UCITS ETF USD (GBP) ACC,,FWRG,https://www.charles-stanley-direct.co.uk/ViewShare?InvestmentId=I2Z9BU0YISE%3D
ISHARES VI PLC US LARGE CAP DEEP BUFFER UCITS ETF USD(G,,USDB,https://www.charles-stanley-direct.co.uk/ViewShare?InvestmentId=Hq0hulf9Dkw%3D
XTRACKERS (IE) PLC MSCI EM EX CHINA UCITS ETF 1C USD(GBP),,XDEG,https://www.charles-stanley-direct.co.uk/ViewShare?InvestmentId=gzES2RiJC%2B0%3D
INVESCO MARKETS II PLC S&P 500 EQUAL WEIGHT UCITS ETF DIS,,SPED,https://www.charles-stanley-direct.co.uk/ViewShare?InvestmentId=Q8y3TNjGtds%3D
INVESCO MARKETS II PLC S&P 500 EQUAL WEIGHT UCITS ETF DIS,,SPES,https://www.charles-stanley-direct.co.uk/ViewShare?InvestmentId=mgdCclH1ZQo%3D
ISHARES VII PLC USD TREASURY BD 3-7YR UCITS ETF GBP ACC,,CBGA,https://www.charles-stanley-direct.co.uk/ViewShare?InvestmentId=gEzP3rq34y8%3D
ISHARES II PLC USD TREASURY BD 7-10YR UCITS ETF GBP ACC,,IGTA,https://www.charles-stanley-direct.co.uk/ViewShare?InvestmentId=8rJU%2BhqR3N4%3D
UBS (LUX) FUND SOLUTIONS SICAV UBS M SWITZD 20/35 UCITS ETF,,UC94,https://www.charles-stanley-direct.co.uk/ViewShare?InvestmentId=2He0MlYmPUQ%3D
XTRACKERS (IE) PLC NASDAQ 100 SWAP UCITS ETF 1D USD(GBP) UN,,XNDX,https://www.charles-stanley-direct.co.uk/ViewShare?InvestmentId=m6PkkDY5wuU%3D
INVESCO MARKETS II PLC US TREASURY BD UCITS ETF USD(GBP) ACC,,TRAG,https://www.charles-stanley-direct.co.uk/ViewShare?InvestmentId=85EkY86TBZQ%3D
XTRACKERS (IE) PLC MSCI WORLD INFO TECH UCITS ETF 1C USD(GB,,XXTW,https://www.charles-stanley-direct.co.uk/ViewShare?InvestmentId=xHbEv2t%2F%2F5Q%3D
FRANKLIN TEMPLETON ICAV US TREASURY 0-1 YEAR UCITS ETF USD ACC,,SHOR,https://www.charles-stanley-direct.co.uk/ViewShare?InvestmentId=FdfqM0YIXJw%3D
XTRACKERS (IE) PLC MSCI WORLD SMALL CAP UCITS ETF 1D USD(GB,,XSWS,https://www.charles-stanley-direct.co.uk/ViewShare?InvestmentId=ED0Vu2yA8mg%3D
BNP PARIBAS EASY SICAV S&P 500 II UCITS ETF USD CAP,,SPTR,https://www.charles-stanley-direct.co.uk/ViewShare?InvestmentId=8lDrU%2BWQTSM%3D
UBS (LUX) FUND SOLUTIONS SICAV UBS BBG TIPS 1-10 UCITS ETF,,UBTS,https://www.charles-stanley-direct.co.uk/ViewShare?InvestmentId=E62UW2Afv6g%3D
ISHARES IV PLC USD TRSRY BD 20+YR UCITS ETF USD DIST,,IDTL,https://www.charles-stanley-direct.co.uk/ViewShare?InvestmentId=j%2FyiJ78AZyY%3D
INVESCO MARKETS II PLC MSCI WORLD EQUAL WEIGHT UCITS ETF USD(GB,,MWEP,https://www.charles-stanley-direct.co.uk/ViewShare?InvestmentId=GGFc2yPd4dk%3D
ISHARES III PLC S&P 500 EQUAL WEIGHT UCITS ETF USD ACC,,EWSX,https://www.charles-stanley-direct.co.uk/ViewShare?InvestmentId=ZyOWCFwwyzI%3D
ROBECO UCITS ICAV 3D EM EQUITY UCITS ETF USD(GBP) ACC UNHD,,REMG,https://www.charles-stanley-direct.co.uk/ViewShare?InvestmentId=OWFrkYg2BS0%3D
INVESCO MARKETS II PLC MSCI EUROPE EQUAL WEIGHT UCITS ETF EUR(G,,MEEQ,https://www.charles-stanley-direct.co.uk/ViewShare?InvestmentId=nAg3sEczCi8%3D
UBS (LUX) FUND SOLUTIONS SICAV UBS M SWITZD 20/35 UCITS ETF,,UC93,https://www.charles-stanley-direct.co.uk/ViewShare?InvestmentId=0jUVrdCkiyc%3D
ISHARES III PLC MSCI WLD SMALL CAP UCITS ETF USD(GBP) AC,,WLDS,https://www.charles-stanley-direct.co.uk/ViewShare?InvestmentId=99JGINW7sVc%3D
ALPHA UCITS SICAV FAIR OAKS AAA CLO ETF F EUR(GBP) DIS,,AAAG,https://www.charles-stanley-direct.co.uk/ViewShare?InvestmentId=PW0Kz9Nc%2F7Q%3D
ISHARES VII PLC S&P 500 TOP 20 UCITS ETF USD ACC,,SP20,https://www.charles-stanley-direct.co.uk/ViewShare?InvestmentId=cem3UV5GSmg%3D
ISHARES IV PLC USD TRSRY BD 20+YR UCITS ETF USD DIST,,IBTL,https://www.charles-stanley-direct.co.uk/ViewShare?InvestmentId=aNN6AKo8xMw%3D
XTRACKERS (IE) PLC S&P 500 GARP UCITS ETF 1C USD UNHDG,,XUGA,https://www.charles-stanley-direct.co.uk/ViewShare?InvestmentId=ssJkIq5Biac%3D
XTRACKERS (IE) PLC S&P 500 MARKET LEADERS UCITS ETF 1C USD,,XUML,https://www.charles-stanley-direct.co.uk/ViewShare?InvestmentId=6lD0dcNtgrU%3D
FRANKLIN TEMPLETON ICAV US MEGA CAP 100 UCITS ETF USD(GBP) ACC,,U100,https://www.charles-stanley-direct.co.uk/ViewShare?InvestmentId=YiQ95299Two%3D
INVESCO MARKETS II PLC US ENHANCED EQUITY UCITS ETF USD(GBP) AC,,IQUX,https://www.charles-stanley-direct.co.uk/ViewShare?InvestmentId=9vfqKSaTOwM%3D
ISHARES II PLC MSCI EM LAT AM UCITS ETF USD DIS GBP,,LTAM,https://www.charles-stanley-direct.co.uk/ViewShare?InvestmentId=i15zhbwGnWI%3D
ISHARES III PLC JP MORGAN EM LOC GOVT BD UCITS ETF USD,,IEML,https://www.charles-stanley-direct.co.uk/ViewShare?InvestmentId=xUR7IW0F4Zc%3D
ISHARES III PLC JP MORGAN EM LOC GOVT BD UCITS ETF USD,,SEML,https://www.charles-stanley-direct.co.uk/ViewShare?InvestmentId=GMBN%2Fh%2FNxSo%3D
INVESCO MARKETS PLC INDS S&P US SELECT SECT UCITS ETF A USD,,XLIS,https://www.charles-stanley-direct.co.uk/ViewShare?InvestmentId=MN9cxEgJnkg%3D
LEGAL & GENERAL UCITS ETF PLC L&G LONGER DATED ALL COMMODITIES USD,,COMF,https://www.charles-stanley-direct.co.uk/ViewShare?InvestmentId=LU0Rn2r3saI%3D
ISHARES III PLC CORE EUR GOVT BOND UCITS ETF EUR DIST GB,,SEGA,https://www.charles-stanley-direct.co.uk/ViewShare?InvestmentId=qiykN558D5U%3D
UBS (IRL) FUND SOLUTIONS PLC UBS CMCI COMPOSITE SF ETF HGBP ACC,,UC90,https://www.charles-stanley-direct.co.uk/ViewShare?InvestmentId=zaFS84hZQLQ%3D
UBS (LUX) FUND SOLUTIONS SICAV UBS M USA SOC RESP UCITS ETF,,UC46,https://www.charles-stanley-direct.co.uk/ViewShare?InvestmentId=ogEj3XsnmGI%3D
ISHARES V PLC JP MORGAN EM CORP BD UCITS ETF USD DIS,,EMCP,https://www.charles-stanley-direct.co.uk/ViewShare?InvestmentId=8s1sVK8v6oU%3D
MULTI UNITS LUXEMBOURG AMND MSCI WLD INFO TECH UCT ETF USD ACC,,TNOW,https://www.charles-stanley-direct.co.uk/ViewShare?InvestmentId=h%2F4IUojvcW4%3D
ISHARES III PLC EMR ASIA LCAL GOVT BD UCITS ETF GBP DIST,,SGEA,https://www.charles-stanley-direct.co.uk/ViewShare?InvestmentId=ghD0IyLbjl0%3D
UBS (LUX) FUND SOLUTIONS SICAV UBS M EMU SML CAP UCITS ETF,,UB69,https://www.charles-stanley-direct.co.uk/ViewShare?InvestmentId=Sl9DNdUwLa0%3D
UBS (LUX) FUND SOLUTIONS SICAV UBS MSCI CANADA UCITS ETF CAD DIS,,UB23,https://www.charles-stanley-direct.co.uk/ViewShare?InvestmentId=EWm4zPdAl%2Fs%3D
UBS (LUX) FUND SOLUTIONS SICAV UBS M EMU SOC RESP UCITS ETF,,UB39,https://www.charles-stanley-direct.co.uk/ViewShare?InvestmentId=RQxBB%2Fy6Crg%3D
VANGUARD FUNDS PLC FTSE ALL WLD HIGH DIV YLD UCITS ETF USD,,VHYD,https://www.charles-stanley-direct.co.uk/ViewShare?InvestmentId=S5PqIKcMeRY%3D
ISHARES VI PLC EDGE MSCI EURP MIN VOL UCITS ETF EUR ACC,,IMV,https://www.charles-stanley-direct.co.uk/ViewShare?InvestmentId=iltPqPlO6y8%3D
ISHARES IV PLC USD TREASURY BD 20YR UCTS ETF EUR DIS HD,,DTLE,https://www.charles-stanley-direct.co.uk/ViewShare?InvestmentId=tXWp93CIIyc%3D
MULTI UNITS LUXEMBOURG AMUNDI CORE FTSE 100 SWAP ETF USD HDG AC,,100H,https://www.charles-stanley-direct.co.uk/ViewShare?InvestmentId=1iZJSvBX42o%3D
INVESCO MARKETS III PLC INVESCO EQQQ NASDAQ 100 UCITS ETF GBP HG,,EQGB,https://www.charles-stanley-direct.co.uk/ViewShare?InvestmentId=a17GaTxex88%3D
ISHARES II PLC JP MORGAN EM BOND UCITS ETF GBP HDG DIS,,EMHG,https://www.charles-stanley-direct.co.uk/ViewShare?InvestmentId=nF7WJZSteI8%3D
AMUNDI INDEX SOLUTIONS AMND PEA MSCI USA ESG SLCT UCITS ETF USD,,CU2U,https://www.charles-stanley-direct.co.uk/ViewShare?InvestmentId=BkRcQnS3d3c%3D
GLOBAL X ETFS ICAV GLOBAL X ETFS ICAV CLEANTECH UCITS E USD,,CTEK,https://www.charles-stanley-direct.co.uk/ViewShare?InvestmentId=e0qgiZ8mnsc%3D
GLOBAL X ETFS ICAV GLOBAL X ETFS ICAV CLEANTECH UCITS E GBP,,CTEG,https://www.charles-stanley-direct.co.uk/ViewShare?InvestmentId=ZQlQ87%2FvSB0%3D
GLOBAL X ETFS ICAV GLOBAL X ETFS ICAV INTERNET THING UC USD,,SNSR,https://www.charles-stanley-direct.co.uk/ViewShare?InvestmentId=ND9fDRB%2BETE%3D
GLOBAL X ETFS ICAV GLOBAL X ETFS ICAV INTERNET THIN USD GBP,,SNSG,https://www.charles-stanley-direct.co.uk/ViewShare?InvestmentId=JE6rnj1sigI%3D
JPMORGAN ETFS (IRELAND) ICAV GLOBAL IG CORPORATE BOND ACTIVE UCITS ET,,JGGG,https://www.charles-stanley-direct.co.uk/ViewShare?InvestmentId=2odZF4zflRc%3D
JPMORGAN ETFS (IRELAND) ICAV GLOBAL IG CORPORATE BOND ACTIVE UCITS ET,,JIGG,https://www.charles-stanley-direct.co.uk/ViewShare?InvestmentId=l%2BfgEJwVsZ8%3D
JPMORGAN ETFS (IRELAND) ICAV GLOBAL IG CORPORATE BOND ACTIVE UCITS ET,,JIGD,https://www.charles-stanley-direct.co.uk/ViewShare?InvestmentId=WI5TQ3YI5rA%3D
JPMORGAN ETFS (IRELAND) ICAV GLOBAL IG CORPORATE BOND ACTIVE UCITS ET,,JGIG,https://www.charles-stanley-direct.co.uk/ViewShare?InvestmentId=9ras4zfeg6k%3D
JPMORGAN ETFS (IRELAND) ICAV GLOBAL IG CORPORATE BOND ACTIVE UCITS ET,,JUIG,https://www.charles-stanley-direct.co.uk/ViewShare?InvestmentId=AeCLP0YtBgE%3D
JPMORGAN ETFS (IRELAND) ICAV GLOBAL IG CORPORATE BOND ACTIVE UCITS ET,,JIDG,https://www.charles-stanley-direct.co.uk/ViewShare?InvestmentId=jJsh9fDZYjs%3D
SSGA SPDR ETFS EUROPE II PLC SS SPDR MORNINGSTAR GLOB INFRA ET,,MAGI,https://www.charles-stanley-direct.co.uk/ViewShare?InvestmentId=vjzVwqagVVg%3D
SSGA SPDR ETFS EUROPE II PLC SS SPDR MORNINGSTAR GLOB INFRA ET,,GIN,https://www.charles-stanley-direct.co.uk/ViewShare?InvestmentId=eNaJjim4LUw%3D
VANECK UCITS ETFS PLC US FALLEN ANGEL HIGH YIELD BOND UCITS ET,,USFA,https://www.charles-stanley-direct.co.uk/ViewShare?InvestmentId=XeuW1VJeeB4%3D
AMUNDI ASSET MANAGEMENT SA (LYXOR MSCI WRLD ESG LEAD)ETF EUR,,WGES,https://www.charles-stanley-direct.co.uk/ViewShare?InvestmentId=%2FpoiRVQ6B2Y%3D
VANECK UCITS ETFS PLC VNCK UC ETFS JPM EM LOC CCY BD UC A GBP,,EMGB,https://www.charles-stanley-direct.co.uk/ViewShare?InvestmentId=73kUyds2HIo%3D
SSGA SPDR ETFS EUROPE I PLC SS SPDR BLOOM UK GILT UCITS ET,,GLTY,https://www.charles-stanley-direct.co.uk/ViewShare?InvestmentId=1MX35QN7rXc%3D
HSBC ETFS PLC MSCI INDONESIA UCITS USD,,HIDD,https://www.charles-stanley-direct.co.uk/ViewShare?InvestmentId=Opnv4ZiwCsU%3D
GLOBAL X ETFS ICAV EUROPEAN INFRASTRUCTURE DEVELOPMENT UCIT,,BRIP,https://www.charles-stanley-direct.co.uk/ViewShare?InvestmentId=BD7L1WDnqxA%3D
GLOBAL X ETFS ICAV EUROPEAN INFRASTRUCTURE DEVELOPMENT UCIT,,BRIJ,https://www.charles-stanley-direct.co.uk/ViewShare?InvestmentId=eEw7y3sjWb4%3D
SSGA SPDR ETFS EUROPE I PLC SS SPDRBLOOMBSASBUSHIGHYIELDCORP,,SJHY,https://www.charles-stanley-direct.co.uk/ViewShare?InvestmentId=XSyV0J0nnNQ%3D
PACER ETFS ICAV DEVELOPED MARKETS INTERNATIONAL CASH COW,,ICOW,https://www.charles-stanley-direct.co.uk/ViewShare?InvestmentId=ZWqOZ2zy6iU%3D
GLOBAL X ETFS ICAV G.X E.I.G.X 1-3 EOD,,CLIP,https://www.charles-stanley-direct.co.uk/ViewShare?InvestmentId=U93tboLDPqQ%3D
GLOBAL X ETFS ICAV G.X E.I.G.X 1-3 EOD,,CLPP,https://www.charles-stanley-direct.co.uk/ViewShare?InvestmentId=vIssSnI2r68%3D
HSBC ETFS PLC FTSE EPRA NAREIT DEVELOPED CLIMATE PARIS,,HPNA,https://www.charles-stanley-direct.co.uk/ViewShare?InvestmentId=nz6OU8I%2BdJM%3D
HSBC ETFS PLC MSCI PACIFIC EX JAPAN (GBP) UCITS,,HMXJ,https://www.charles-stanley-direct.co.uk/ViewShare?InvestmentId=8Pc1KYXEOjs%3D
HSBC ETFS PLC PLUS EMERGING MARKETS EQUITY QUANT ACTIV,,HQEM,https://www.charles-stanley-direct.co.uk/ViewShare?InvestmentId=Wdn1xJGYRXA%3D
HSBC ETFS PLC FTSE EPRA NAREIT DEVELOPED CLIMATE PARIS,,HPES,https://www.charles-stanley-direct.co.uk/ViewShare?InvestmentId=ASmxGB8H%2FHo%3D
HSBC ETFS PLC PLUS EMERGING MARKETS EQUITY QUANT ACTIV,,HQES,https://www.charles-stanley-direct.co.uk/ViewShare?InvestmentId=amT3aHkZYyM%3D
HSBC ETFS PLC PLUS EMERGING MARKETS EQUITY INCOME QUAN,,HQIE,https://www.charles-stanley-direct.co.uk/ViewShare?InvestmentId=slvXDS7Rr6k%3D
HSBC ETFS PLC PLUS EMERGING MARKETS EQUITY INCOME QUAN,,HQED,https://www.charles-stanley-direct.co.uk/ViewShare?InvestmentId=frRGbcS54G8%3D
HSBC ETFS PLC MULTI FACTOR WORLDWIDE EQTY UCITS USD,,HWWD,https://www.charles-stanley-direct.co.uk/ViewShare?InvestmentId=rtddi0AOi9g%3D
HSBC ETFS PLC FTSE EPRA NAREIT DEVELOPED CLIMATE PARIS,,HPED,https://www.charles-stanley-direct.co.uk/ViewShare?InvestmentId=LKDuwVdqiZo%3D
HSBC ETFS PLC FTSE EPRA NAREIT DEVELOPED CLIMATE PARIS,,HPNS,https://www.charles-stanley-direct.co.uk/ViewShare?InvestmentId=fre7q0zRtE0%3D
SSGA SPDR ETFS EUROPE II PLC SS SPDR S&P US MTRLS SEL SCTR UCS ETFUSD,,SXLB,https://www.charles-stanley-direct.co.uk/ViewShare?InvestmentId=Hkq0t6gW7mQ%3D
SSGA SPDR ETFS EUROPE II PLC SS SPDR S&P US UTLTS SEL SCTR UCS ETFUSD,,SXLU,https://www.charles-stanley-direct.co.uk/ViewShare?InvestmentId=pudrWh5pOB0%3D
VANECK UCITS ETFS PLC GENOMICS & HEALTHCARE INNOVATORS UCITS E,,CURE,https://www.charles-stanley-direct.co.uk/ViewShare?InvestmentId=ZZ9jQzLPY1k%3D
HSBC ETFS PLC FTSE EPRA/NAREIT DEV PROPERTY UCITS USD,,HPRD,https://www.charles-stanley-direct.co.uk/ViewShare?InvestmentId=Fa5EjfcfyPg%3D
HSBC ETFS PLC FTSE EPRA/NAREIT DEV PROPERTY UCITS GBP,,HPRO,https://www.charles-stanley-direct.co.uk/ViewShare?InvestmentId=Bk7taPL9llA%3D
HSBC ETFS PLC MULTI FACTOR WORLDWIDE EQTY UCITS USD(GB,,HWWA,https://www.charles-stanley-direct.co.uk/ViewShare?InvestmentId=DWhoaBhFeYk%3D
SSGA SPDR ETFS EUROPE II PLC MSCI EUROPE UCITS(GBP),,ERO,https://www.charles-stanley-direct.co.uk/ViewShare?InvestmentId=bWrBUVlJI%2BM%3D
JPMORGAN ETFS (IRELAND) ICAV GLOBAL EM RESEARCH ENHANCED INDEX EQUITY,,JSEM,https://www.charles-stanley-direct.co.uk/ViewShare?InvestmentId=RXYQISsfTHo%3D
JPMORGAN ETFS (IRELAND) ICAV GLOBAL EM RESEARCH ENHANCED INDEX EQUITY,,JSMD,https://www.charles-stanley-direct.co.uk/ViewShare?InvestmentId=bpYDormEjU0%3D
JPMORGAN ETFS (IRELAND) ICAV ALL COUNTRY RESEARCH ENHANCED INDEX EQUI,,JRAW,https://www.charles-stanley-direct.co.uk/ViewShare?InvestmentId=qwuTCd%2Bzy90%3D
JPMORGAN ETFS (IRELAND) ICAV ALL COUNTRY RESEARCH ENHANCED INDEX EQUI,,JRWU,https://www.charles-stanley-direct.co.uk/ViewShare?InvestmentId=FSR3h%2FtT%2FSM%3D
JPMORGAN ETFS (IRELAND) ICAV NASDAQ HDG EQUITY LADDERED OVERLAY ACTIV,,HEQD,https://www.charles-stanley-direct.co.uk/ViewShare?InvestmentId=HdDRiIRjWlA%3D
JPMORGAN ETFS (IRELAND) ICAV ALL COUNTRY RESEARCH ENHANCED INDEX EQUI,,JRUW,https://www.charles-stanley-direct.co.uk/ViewShare?InvestmentId=SHjOscNEo0U%3D
JPMORGAN ETFS (IRELAND) ICAV GLOBAL EM RESEARCH ENHANCED INDEX EQUITY,,JSME,https://www.charles-stanley-direct.co.uk/ViewShare?InvestmentId=%2FmLQZXWHQiQ%3D
JPMORGAN ETFS (IRELAND) ICAV NASDAQ EQ PREM INC ACT UCT,,JEAQ,https://www.charles-stanley-direct.co.uk/ViewShare?InvestmentId=twwbOFlsQ6A%3D
HSBC ETFS PLC HSBC MSCI EM SC SCR USD ACC,,HESS,https://www.charles-stanley-direct.co.uk/ViewShare?InvestmentId=SHb9b%2BIzaTM%3D
JPMORGAN ETFS (IRELAND) ICAV EMERGING MARKETS LOCAL CURRENCY BOND ACT,,JLDO,https://www.charles-stanley-direct.co.uk/ViewShare?InvestmentId=Bwd6eHuvipM%3D
