name,isin,url
XTRACKERS S&P SELECT FRONTIER UCITS ETF GBP ACC,,https://www.charles-stanley-direct.co.uk/ViewShare?InvestmentId=IyLMi0J0OmU%3D
ISHARES MSCI EURO EX-UK UCITS ETF EUR DIST,,https://www.charles-stanley-direct.co.uk/ViewShare?InvestmentId=DubqvjjQSCQ%3D
ISHARES USD TREASURY BD1-3YR UCITS ETF USD DIST,,https://www.charles-stanley-direct.co.uk/ViewShare?InvestmentId=hM%2FgGtPOXzQ%3D
FRANKLIN TEMPLETON ICAV FTSE JAPAN UCITS ETF JPY(GBP),,https://www.charles-stanley-direct.co.uk/ViewShare?InvestmentId=%2F97UBiYS16o%3D
ISHARES IV PLC METAVERSE UCITS ETF USD(GBP) ACC,,https://www.charles-stanley-direct.co.uk/ViewShare?InvestmentId=pi3Fnr5y4Lw%3D
JANUS HENDERSON ICAV GLOBAL RESEARCH-ENGINEERED UCITS ETF USD,,https://www.charles-stanley-direct.co.uk/ViewShare?InvestmentId=cQODvSKpZ3o%3D
ISHARES USD TREASURY BD1-3YR UCITS ETF USD DIST,,https://www.charles-stanley-direct.co.uk/ViewShare?InvestmentId=kZTAGP2eElE%3D
XTRACKERS S&P SELECT FRONTIER UCITS ETF USD ACC,,https://www.charles-stanley-direct.co.uk/ViewShare?InvestmentId=mVsdMQwDKOo%3D
XTRACKERS S&P 500 SWAP UCTS ETF 1C ACC,,https://www.charles-stanley-direct.co.uk/ViewShare?InvestmentId=12P0%2F2N3M78%3D
XTRACKERS S&P 500 SWAP UCTS ETF 1C ACC,,https://www.charles-stanley-direct.co.uk/ViewShare?InvestmentId=g9PWFO05qUs%3D
WISDOMTREE ISSUER ICAV BIOREVOLUTION UCITS ETF USD(GBP) ACC,,https://www.charles-stanley-direct.co.uk/ViewShare?InvestmentId=PHj0zYAwDJs%3D
XTRACKERS S&P 500 SWAP 7C ETF GBP HDG,,https://www.charles-stanley-direct.co.uk/ViewShare?InvestmentId=NJjvxRpZLGo%3D
HSBC GLOBAL FUNDS ICAV GLOBAL GOVERNMENT BOND UCITS ETF ETFCH U,,https://www.charles-stanley-direct.co.uk/ViewShare?InvestmentId=23zY2eLKgWM%3D
HSBC GLOBAL FUNDS ICAV HSBC ICAV CHINA GOV BOND ETF ETFCH,,https://www.charles-stanley-direct.co.uk/ViewShare?InvestmentId=VciAWsvhkNI%3D
HSBC GLOBAL FUNDS ICAV HSBC ICAV CHINA GOV BOND ETF ETFSHGBP,,https://www.charles-stanley-direct.co.uk/ViewShare?InvestmentId=eMfQJx83j7k%3D
FIDELITY UCITS II ICAV FIDELITY USD CB ETF ACC,,https://www.charles-stanley-direct.co.uk/ViewShare?InvestmentId=plSVLjhufE4%3D
FIDELITY UCITS II ICAV FIDELITY USD CB ETF ACC,,https://www.charles-stanley-direct.co.uk/ViewShare?InvestmentId=EG%2FmEHc3zu4%3D
JANUS HENDERSON ICAV JH MBS ACTIVE ETF USD D,,https://www.charles-stanley-direct.co.uk/ViewShare?InvestmentId=jkLeSDzBbU0%3D
MULTI UNITS LUXEMBOURG AMUNDI GLOBAL GOVERNMENT BOND ETF DIS,,https://www.charles-stanley-direct.co.uk/ViewShare?InvestmentId=uB425VVUSKA%3D
MULTI UNITS LUXEMBOURG AMUNDI GLOBAL GOVERNMENT BOND ETF DIS,,https://www.charles-stanley-direct.co.uk/ViewShare?InvestmentId=hWVC9QQwPHY%3D
XTRACKERS (IE) PLC MSCI EMERGING MKTS ESG UCITS ETF,,https://www.charles-stanley-direct.co.uk/ViewShare?InvestmentId=UV5UWVX6BJI%3D
AMUNDI INDEX SOLUTIONS PRIME EMERGING MKTS UCITS ETF USD,,https://www.charles-stanley-direct.co.uk/ViewShare?InvestmentId=VBwkDhXQyco%3D
XTRACKERS II EUROZONE GOVERNMENT BOND UCITS ETF 2D GB,,https://www.charles-stanley-direct.co.uk/ViewShare?InvestmentId=eGaWCPjPJa0%3D
HANETF ICAV INQQ INDIA INTERNET UCITS ETF USD ACC,,https://www.charles-stanley-direct.co.uk/ViewShare?InvestmentId=FYVe67LYhcQ%3D
HANETF ICAV INQQ INDIA INTERNET UCITS ETF ACC GBX,,https://www.charles-stanley-direct.co.uk/ViewShare?InvestmentId=RBVoYYfbtFw%3D
AB SICAV I GLOBAL CORP BOND PORTFOLIO UCITS ETF,,https://www.charles-stanley-direct.co.uk/ViewShare?InvestmentId=44tgG%2FRBeyQ%3D
MULTI UNITS FRANCE AMUNDI FTSE MIB UCITS ETF DIST,,https://www.charles-stanley-direct.co.uk/ViewShare?InvestmentId=jTSupaPvBsE%3D
HANETF ICAV SPROTT COPPER MINERS UCITS ETF ACC GBX,,https://www.charles-stanley-direct.co.uk/ViewShare?InvestmentId=LyZwnoPSzGU%3D
WISDOMTREE ISSUER ICAV US QUALITY DIVIDEND GROWTH UCITS ETF,,https://www.charles-stanley-direct.co.uk/ViewShare?InvestmentId=NanBBVlihKg%3D
ISHARES II PLC LISTED PRVT EQTY UCITS ETF ACC,,https://www.charles-stanley-direct.co.uk/ViewShare?InvestmentId=LYagpsKDddc%3D
AB SICAV I GLOBAL CORP BOND PORTFOLIO UCITS ETF,,https://www.charles-stanley-direct.co.uk/ViewShare?InvestmentId=fj3YX5uzWM4%3D
XTRACKERS II US TREASURIES 10+ UCITS ETF 1D USD,,https://www.charles-stanley-direct.co.uk/ViewShare?InvestmentId=1eZ9bzkPG3o%3D
INVESCO MARKETS PLC NASDAQ BIOTECHNOLOGY UCITS ETF A USD(GBP,,https://www.charles-stanley-direct.co.uk/ViewShare?InvestmentId=EPXOUyydTzo%3D
XTRACKERS (IE) PLC X FTSE ALL WORLD ETF 1C,,https://www.charles-stanley-direct.co.uk/ViewShare?InvestmentId=Qhbi33EU18k%3D
HANETF ICAV AMERANT LATIN AMERICAN DEBT UCITS ETF US,,https://www.charles-stanley-direct.co.uk/ViewShare?InvestmentId=zeH36s0Zd90%3D
FRANKLIN TEMPLETON ICAV FRANKLIN EM MULTIFACTOR EQUITY UCITS ETF,,https://www.charles-stanley-direct.co.uk/ViewShare?InvestmentId=bukIJE4ilU0%3D
XTRACKERS (IE) PLC MSCI WORLD UCITS ETF 1D USD,,https://www.charles-stanley-direct.co.uk/ViewShare?InvestmentId=BggpnWuRUDc%3D
HANETF ICAV EMQQ EMG MARKETS INTERNET UCITS ETF ACC,,https://www.charles-stanley-direct.co.uk/ViewShare?InvestmentId=9SD7CGNJ59Q%3D
ISHARES II PLC FTSE MIB UCITS ETF EUR DIS,,https://www.charles-stanley-direct.co.uk/ViewShare?InvestmentId=VxuOvvS6vhE%3D
ISHARES II PLC GLOBAL WATER UCITS ETF USD DIST,,https://www.charles-stanley-direct.co.uk/ViewShare?InvestmentId=MH3YNvAZ%2FKg%3D
ISHARES II PLC UK PROPERTY UCITS ETF GBP DIST,,https://www.charles-stanley-direct.co.uk/ViewShare?InvestmentId=5829%2B4akihw%3D
ISHARES II PLC GLOBAL WATER UCITS ETF USD DIST,,https://www.charles-stanley-direct.co.uk/ViewShare?InvestmentId=x2HPnEzf8Uw%3D
XTRACKERS XTRACKERS MSCI JAPAN UCT ETF 1C USD ACC,,https://www.charles-stanley-direct.co.uk/ViewShare?InvestmentId=WXppRoNTnhU%3D
ISHARES II PLC ASIA PROPERTY YIELD ETF USD DIST,,https://www.charles-stanley-direct.co.uk/ViewShare?InvestmentId=V1cJvhPR6aI%3D
XTRACKERS FTSE VIETNAM SWAP UCITS ETF 1C USD (GBP),,https://www.charles-stanley-direct.co.uk/ViewShare?InvestmentId=GRsrpxotbbY%3D
XTRACKERS LPX MM PRIVATE EQTY UCITS ETF GBP ACC,,https://www.charles-stanley-direct.co.uk/ViewShare?InvestmentId=9wQR6hddfYU%3D
MULTI UNITS LUXEMBOURG AMUNDI DAX II UCITS ETF ACC,,https://www.charles-stanley-direct.co.uk/ViewShare?InvestmentId=qFaSK%2BIvQWc%3D
XTRACKERS MSCI EURO ENGY ESG SCREENED UCITS ETF 1C,,https://www.charles-stanley-direct.co.uk/ViewShare?InvestmentId=MghOiX8dTeY%3D
XTRACKERS MSCI EURO HLTH CARE ESG SCREENED ETF 1C,,https://www.charles-stanley-direct.co.uk/ViewShare?InvestmentId=8KYo2lM3uVI%3D
XTRACKERS MSCI EURO FINS ESG SCREENED UCITS ETF 1C,,https://www.charles-stanley-direct.co.uk/ViewShare?InvestmentId=I6XxTeQA9vo%3D
BNP PARIBAS EASY ICAV ALPHA ENHANCED WORLD UCITS ETF USD CAP,,https://www.charles-stanley-direct.co.uk/ViewShare?InvestmentId=8nBEB2bmDqk%3D
XTRACKERS (IE) PLC US EQUITY ENHANCED ACTIVE UCITS ETF 1C U,,https://www.charles-stanley-direct.co.uk/ViewShare?InvestmentId=bPew7EhKfBc%3D
WISDOMTREE ISSUER ICAV WISDOMTREE TR EMG MKTS UCITS ETF USD ACC,,https://www.charles-stanley-direct.co.uk/ViewShare?InvestmentId=aZJQ19XPL%2FQ%3D
WISDOMTREE ISSUER ICAV WISDOMTREE TR EMG MKTS UCITS ETF USD ACC,,https://www.charles-stanley-direct.co.uk/ViewShare?InvestmentId=UC2%2Bdgduz1U%3D
XTRACKERS MSCI EMU IDX UCTS ETF (DR) 1C USD H C,,https://www.charles-stanley-direct.co.uk/ViewShare?InvestmentId=Vzq1nA2%2FCo0%3D
ISHARES VII PLC ISHARES MSCI EMU SMALL CAP UCITS ETF EUR,,https://www.charles-stanley-direct.co.uk/ViewShare?InvestmentId=x9J6aRoPQcs%3D
ISHARES III PLC MSCI SOUTH AFRICA UCITS ETF USD ACC GBP,,https://www.charles-stanley-direct.co.uk/ViewShare?InvestmentId=4HjM74cvioM%3D
ISHARES II PLC TREASURY BD 7 10YR UCITS ETF USD DIS,,https://www.charles-stanley-direct.co.uk/ViewShare?InvestmentId=r5Z5kKLEXFo%3D
ISHARES II PLC DEV MRKTS PROP YIELD UCITS ETF GBP DIST,,https://www.charles-stanley-direct.co.uk/ViewShare?InvestmentId=kKhv6idc8EE%3D
ISHARES II PLC TREASURY BD 7 10YR UCITS ETF USD DIS,,https://www.charles-stanley-direct.co.uk/ViewShare?InvestmentId=jLzP7nMaOpU%3D
ISHARES III PLC ISHARES CORE GBL AGGRG BD UCITS ETF USD,,https://www.charles-stanley-direct.co.uk/ViewShare?InvestmentId=FIkT8LTmRjA%3D
ISHARES III PLC MSCI EM SMALL CAP UCITS ETF USD DIS,,https://www.charles-stanley-direct.co.uk/ViewShare?InvestmentId=bA%2FPNHLhF60%3D
ISHARES III PLC GLOBAL GOVT BOND UCITS ETF USD DIST GBP,,https://www.charles-stanley-direct.co.uk/ViewShare?InvestmentId=s3D0Y%2FSNGsc%3D
ISHARES III PLC ISHARES CORE GBL AGGRG BD UCITS ETF USD,,https://www.charles-stanley-direct.co.uk/ViewShare?InvestmentId=kE4miEQIwLI%3D
ISHARES III PLC GLOBAL GOVT BOND UCITS ETF USD DIST GBP,,https://www.charles-stanley-direct.co.uk/ViewShare?InvestmentId=aSum3O9T58k%3D
ISHARES III PLC EUR AGG BOND UCITS ETF EUR DIST EUR,,https://www.charles-stanley-direct.co.uk/ViewShare?InvestmentId=sHvPPHUXa90%3D
UBS (LUX) FUND SOLUTIONS SICAV UBS CORE M JPN UCITS ETF,,https://www.charles-stanley-direct.co.uk/ViewShare?InvestmentId=6xxwN31Ickk%3D
UBS (LUX) FUND SOLUTIONS SICAV UBS CORE M EMU UCITS ETF,,https://www.charles-stanley-direct.co.uk/ViewShare?InvestmentId=2DJswa7Xg%2Fw%3D
UBS (LUX) FUND SOLUTIONS SICAV UBS CORE M EM UCITS ETF,,https://www.charles-stanley-direct.co.uk/ViewShare?InvestmentId=xX3vqD2%2FBfY%3D
UBS (LUX) FUND SOLUTIONS SICAV UBS CORE M EM UCITS ETF,,https://www.charles-stanley-direct.co.uk/ViewShare?InvestmentId=VQPIt%2BedIZo%3D
MULTI UNITS FRANCE AMUNDI MSCI INDIA SWAP UCITS ETF USD ACC,,https://www.charles-stanley-direct.co.uk/ViewShare?InvestmentId=QdRRQaVyuOA%3D
MULTI UNITS FRANCE AMUNDI JAPAN TOPIX II UCITS ETF EUR DIST,,https://www.charles-stanley-direct.co.uk/ViewShare?InvestmentId=BR2WAd1dII8%3D
ISHARES VI PLC E CRP BND FIN UCITS ETF GBP DIST,,https://www.charles-stanley-direct.co.uk/ViewShare?InvestmentId=d99e%2FASpU2k%3D
INVESCO MARKETS PLC INVESCO MSCI EURP EX-UK UCITS ETF A GBP,,https://www.charles-stanley-direct.co.uk/ViewShare?InvestmentId=Q8TPMaJSKfg%3D
AMUNDI INDEX SOLUTIONS AMND CORE STOXX EUROPE 600 UCITS ETF ACC,,https://www.charles-stanley-direct.co.uk/ViewShare?InvestmentId=RcWJ8UlG%2FkA%3D
XTRACKERS (IE) PLC X MSCI WORLD COM SERVICES UCITS ETF 1C,,https://www.charles-stanley-direct.co.uk/ViewShare?InvestmentId=XUyGAFw%2F21Q%3D
XTRACKERS (IE) PLC MSCI WLD INFO TECH UCITS ETF 1C USD,,https://www.charles-stanley-direct.co.uk/ViewShare?InvestmentId=zo0heGzQd1M%3D
UBS (LUX) FUND SOLUTIONS SICAV UBS M HONG KONG UCITS ETF,,https://www.charles-stanley-direct.co.uk/ViewShare?InvestmentId=DMDRGidriuw%3D
ISHARES II PLC ISHARES II USD TIPS 0 5 UCITS ETF,,https://www.charles-stanley-direct.co.uk/ViewShare?InvestmentId=uBMGUb2vXZE%3D
FIRST TRUST GLOBAL FUNDS ICAV FT DOW JONES INTERNET UCITS ETF,,https://www.charles-stanley-direct.co.uk/ViewShare?InvestmentId=Edgih9e25jU%3D
XTRACKERS II J.P. MOR USD EMERGING MKTS BD UC ETF 2D,,https://www.charles-stanley-direct.co.uk/ViewShare?InvestmentId=wBI%2FpDmykQY%3D
WISDOMTREE ISSUER ICAV WISDOMTREE AT1 COCO BD UCITS ETF USD DIS,,https://www.charles-stanley-direct.co.uk/ViewShare?InvestmentId=OqTMjgA1%2FIM%3D
FIRST TRUST GLOBAL FUNDS ICAV CLOUD COMPUTING UCITS ETF USD ACC,,https://www.charles-stanley-direct.co.uk/ViewShare?InvestmentId=lSAi%2BuYU3ks%3D
FIDELITY UCITS ICAV EMERGING MK QLT INC UCIT ETF INC GBP,,https://www.charles-stanley-direct.co.uk/ViewShare?InvestmentId=nQiDVKxJBAM%3D
ISHARES V PLC MSCI EMER MKTS CNSU GWTH UCITS ETF USD,,https://www.charles-stanley-direct.co.uk/ViewShare?InvestmentId=BgOmrQFbt58%3D
ISHARES V PLC MSCI EM CNSMR GRWTH UCITS ETF USD ACC,,https://www.charles-stanley-direct.co.uk/ViewShare?InvestmentId=udTvjZEOY9g%3D
VANGUARD FUNDS PLC VGI ESG EM ALL CAP ETF (USD) ACC,,https://www.charles-stanley-direct.co.uk/ViewShare?InvestmentId=j0qGmQr42%2FY%3D
VANGUARD FUNDS PLC VGI ESG EM ALL CAP ETF (USD) DIST,,https://www.charles-stanley-direct.co.uk/ViewShare?InvestmentId=WsjneAKc458%3D
VANGUARD FUNDS PLC VANGUARD ESG NA ALL CAP UCITS ETF USDACC,,https://www.charles-stanley-direct.co.uk/ViewShare?InvestmentId=DS4iijK1LRw%3D
AMUNDI INDEX SOLUTIONS AMUNDI IDX MSCI EUROPE SRI PAB UCITS ETF,,https://www.charles-stanley-direct.co.uk/ViewShare?InvestmentId=CNJs89uyCE4%3D
AMUNDI INDEX SOLUTIONS AMUNDI IDX MSCI EUROPE SRI PAB UCITS ETF,,https://www.charles-stanley-direct.co.uk/ViewShare?InvestmentId=bE4DA50nnvc%3D
XTRACKERS (IE) PLC US TREASURS ULTRASHT BD UCITS ETF 1C USD,,https://www.charles-stanley-direct.co.uk/ViewShare?InvestmentId=tibvtYZpklM%3D
XTRACKERS (IE) PLC US TREASURS ULTRASHT BD UCITS ETF 1C GBP,,https://www.charles-stanley-direct.co.uk/ViewShare?InvestmentId=GlLRv2sR%2BJ8%3D
XTRACKERS (IE) PLC MSCI GLOBAL SDG IMPACT UCITS ETF 1C USD,,https://www.charles-stanley-direct.co.uk/ViewShare?InvestmentId=uhW%2BtL8qG8U%3D
XTRACKERS (IE) PLC MSCI GLOBAL SDG IMPACT UCITS ETF 1C USD(,,https://www.charles-stanley-direct.co.uk/ViewShare?InvestmentId=0%2FA2xXwVE1U%3D
XTRACKERS (IE) PLC MSCI GLOBAL SDG 3 GOOD HEALTH UCITS ETF,,https://www.charles-stanley-direct.co.uk/ViewShare?InvestmentId=RHEcJijt7TM%3D
XTRACKERS (IE) PLC MSCI GLOBAL SDG 3 GOOD HEALTH UCITS ETF,,https://www.charles-stanley-direct.co.uk/ViewShare?InvestmentId=wli6PA8LyDY%3D
AMUNDI INDEX SOLUTIONS AMUNDI CORE USD CORPORATE BOND ETF GBP H,,https://www.charles-stanley-direct.co.uk/ViewShare?InvestmentId=pBYQqgRnPjs%3D
AMUNDI INDEX SOLUTIONS AMND CORE GLOBAL GOV BOND UCITS ETF ACC,,https://www.charles-stanley-direct.co.uk/ViewShare?InvestmentId=Bs960eAIj8E%3D
AMUNDI INDEX SOLUTIONS AMND CORE GLOBAL AGGR BOND UCITS ETF ACC,,https://www.charles-stanley-direct.co.uk/ViewShare?InvestmentId=IqCUM%2F12Hwo%3D
