name,isin,url
ISHARES CORE MSCI EM IMI UCITS ETF USD ACC,,https://www.charles-stanley-direct.co.uk/ViewShare?InvestmentId=giIN6qk83Gk%3D
INVESCO MARKETS PLC MSCI USA UCITS ETF USD DIS,,https://www.charles-stanley-direct.co.uk/ViewShare?InvestmentId=qJYKzdN9Ah8%3D
AMUNDI INDEX SOLUTIONS US CORPORATE BOND UCITS ETF DIST,,https://www.charles-stanley-direct.co.uk/ViewShare?InvestmentId=m3fC2UR3noc%3D
MULTI UNITS FRANCE AMUNDI MSCI WATER UCITS ETF DIST,,https://www.charles-stanley-direct.co.uk/ViewShare?InvestmentId=nQ7xnZ406S0%3D
XTRACKERS (IE) PLC GLOBAL SDG 6 WATER UCITS ETF,,https://www.charles-stanley-direct.co.uk/ViewShare?InvestmentId=x8Hfwf5tp6M%3D
XTRACKERS (IE) PLC GLOBAL SDG 6 WATER UCITS ETF,,https://www.charles-stanley-direct.co.uk/ViewShare?InvestmentId=kT2P%2BhN43SA%3D
ARK INVEST UCITS ICAV INNOVATION UCITS ETF USD ACC,,https://www.charles-stanley-direct.co.uk/ViewShare?InvestmentId=5zxeoZugJRw%3D
MULTI UNITS LUXEMBOURG AMUNDI MSCI MILENNIALS UCITS ETF ACC,,https://www.charles-stanley-direct.co.uk/ViewShare?InvestmentId=VIk38RAi5QY%3D
XTRACKERS (IE) PLC MSCI USA INDUSTRIALS UCITS ETF 1D,,https://www.charles-stanley-direct.co.uk/ViewShare?InvestmentId=zU3MowmDYKg%3D
XTRACKERS (IE) PLC NASDAQ 100 UCITS ETF 1C USD,,https://www.charles-stanley-direct.co.uk/ViewShare?InvestmentId=IBkOhHcz3Mk%3D
XTRACKERS (IE) PLC NASDAQ 100 UCITS ETF 1C GBP,,https://www.charles-stanley-direct.co.uk/ViewShare?InvestmentId=QDfAEnod3i0%3D
HANETF ICAV GOLD MINERS SCREENED UCITS ETF USD ACC,,https://www.charles-stanley-direct.co.uk/ViewShare?InvestmentId=SybupQGagg0%3D
HANETF ICAV GOLD MINERS SCREENED UCITS ETF USD ACC,,https://www.charles-stanley-direct.co.uk/ViewShare?InvestmentId=uK6IZzbYQ9M%3D
HANETF ICAV US GBL INVESTORS TRAVEL UCITS ETF USD,,https://www.charles-stanley-direct.co.uk/ViewShare?InvestmentId=uVF9lr67Yjo%3D
HANETF ICAV US GBL INVESTORS TRAVEL UCITS ETF USD,,https://www.charles-stanley-direct.co.uk/ViewShare?InvestmentId=kfv19e97evA%3D
MULTI UNITS LUXEMBOURG AMUNDI GLOBAL GOVERNMENT BOND ETF DIS,,https://www.charles-stanley-direct.co.uk/ViewShare?InvestmentId=hWVC9QQwPHY%3D
MULTI UNITS FRANCE AMUNDI MSCI WATER UCITS ETF ACC,,https://www.charles-stanley-direct.co.uk/ViewShare?InvestmentId=aeKCmYHRYjI%3D
XTRACKERS (IE) PLC MSCI USA UCITS ETF 1C USD,,https://www.charles-stanley-direct.co.uk/ViewShare?InvestmentId=2Tjega1MpNM%3D
XTRACKERS (IE) PLC MSCI USA POSITIONING SCREENED UCITS ETF,,https://www.charles-stanley-direct.co.uk/ViewShare?InvestmentId=d0devXCEB9M%3D
FRANKLIN TEMPLETON ICAV FRK MSCI CH PARIS UCITS ETF,,https://www.charles-stanley-direct.co.uk/ViewShare?InvestmentId=hyCUniSpetM%3D
FRANKLIN TEMPLETON ICAV FRK MSCI CH PARIS UCITS ETF,,https://www.charles-stanley-direct.co.uk/ViewShare?InvestmentId=SYM7nU718Nw%3D
FRANKLIN TEMPLETON ICAV FRK MSCI EM PARIS UCITS ETF,,https://www.charles-stanley-direct.co.uk/ViewShare?InvestmentId=WDhc21bPOM0%3D
FRANKLIN TEMPLETON ICAV FRK MSCI EM PARIS UCITS ETF,,https://www.charles-stanley-direct.co.uk/ViewShare?InvestmentId=sg5uk9qpKNk%3D
HSBC GLOBAL FUNDS ICAV GLOBAL SUKUK UCITS ETF USD,,https://www.charles-stanley-direct.co.uk/ViewShare?InvestmentId=uw%2BRrFN0Fmc%3D
XTRACKERS (IE) PLC MSCI INNOVATION UCITS ETF IC USD,,https://www.charles-stanley-direct.co.uk/ViewShare?InvestmentId=2E4xxsICmp4%3D
ISHARES IV PLC ISHRS MSCI EUMC EQW UCTS ETF,,https://www.charles-stanley-direct.co.uk/ViewShare?InvestmentId=ZmX5LHkhu8A%3D
HANETF ICAV SPROTT JUNIOR URANIUM MINERS UCITS ETF U,,https://www.charles-stanley-direct.co.uk/ViewShare?InvestmentId=dIsLL7pCjk0%3D
HANETF ICAV SPROTT JUNIOR URANIUM MINERS UCITS ETF U,,https://www.charles-stanley-direct.co.uk/ViewShare?InvestmentId=NV6aGbogcHE%3D
HANETF ICAV JUPITER ORIGIN GLOBAL SML COMP ETF USD,,https://www.charles-stanley-direct.co.uk/ViewShare?InvestmentId=Zv7dZ28iAPQ%3D
HANETF ICAV JUPITER ORIGIN GLOBAL SML COMP ETF GBX,,https://www.charles-stanley-direct.co.uk/ViewShare?InvestmentId=8jDtikUzD%2Fo%3D
AB SICAV I EURO CORPORATE BOND PORTFOLIO UCITS ETF,,https://www.charles-stanley-direct.co.uk/ViewShare?InvestmentId=dGqVgAKyjSU%3D
XTRACKERS II US TREASURIES 10+ UCITS ETF 1D USD,,https://www.charles-stanley-direct.co.uk/ViewShare?InvestmentId=1eZ9bzkPG3o%3D
MULTI UNITS LUXEMBOURG AMUNDI MSCI CHINA UCITS ETF ACC,,https://www.charles-stanley-direct.co.uk/ViewShare?InvestmentId=6RWqhzXvujI%3D
XTRACKERS (IE) PLC X FTSE ALL WORLD ETF 1C,,https://www.charles-stanley-direct.co.uk/ViewShare?InvestmentId=Qhbi33EU18k%3D
HANETF ICAV AMERANT LATIN AMERICAN DEBT UCITS ETF US,,https://www.charles-stanley-direct.co.uk/ViewShare?InvestmentId=zeH36s0Zd90%3D
XTRACKERS II HARVEST CHINA GOVT BD UCITS ETF 1D,,https://www.charles-stanley-direct.co.uk/ViewShare?InvestmentId=w8A6YAmGQlY%3D
FRANKLIN TEMPLETON ICAV FRANKLIN EM MULTIFACTOR EQUITY UCITS ETF,,https://www.charles-stanley-direct.co.uk/ViewShare?InvestmentId=bukIJE4ilU0%3D
HANETF ICAV EMQQ EMG MARKETS INTERNET UCITS ETF ACC,,https://www.charles-stanley-direct.co.uk/ViewShare?InvestmentId=9SD7CGNJ59Q%3D
XTRACKERS MSCI EM LATIN AMERICA ESG UCITS ETF 1C,,https://www.charles-stanley-direct.co.uk/ViewShare?InvestmentId=1TKAYR9h49A%3D
ISHARES II PLC UK PROPERTY UCITS ETF GBP DIST,,https://www.charles-stanley-direct.co.uk/ViewShare?InvestmentId=5829%2B4akihw%3D
ISHARES II PLC BIC 50 UCITS ETF USD DIST,,https://www.charles-stanley-direct.co.uk/ViewShare?InvestmentId=Bre9pFNjWxc%3D
XTRACKERS XTRACKERS MSCI JAPAN UCT ETF 1C USD ACC,,https://www.charles-stanley-direct.co.uk/ViewShare?InvestmentId=WXppRoNTnhU%3D
XTRACKERS MSCI MEXICO IDX UCTS ETF 1 USD ACC,,https://www.charles-stanley-direct.co.uk/ViewShare?InvestmentId=sRTRTDsCaHk%3D
ISHARES V PLC EM DIVIDEND UCITS ETF USD DIST,,https://www.charles-stanley-direct.co.uk/ViewShare?InvestmentId=N1zOyxSCwHo%3D
ISHARES VII PLC FTSE MIB UCITS ETF EUR (ACC),,https://www.charles-stanley-direct.co.uk/ViewShare?InvestmentId=kZOV9ec3d48%3D
ISHARES VII PLC NASDAQ 100 UCITS ETF USD ACC,,https://www.charles-stanley-direct.co.uk/ViewShare?InvestmentId=RjI8T%2B1yC6U%3D
ISHARES VII PLC ISHARES NIKKEI 225 UCITS ETF (JPY),,https://www.charles-stanley-direct.co.uk/ViewShare?InvestmentId=RER3qvJLyDA%3D
XTRACKERS MSCI CANADA ESG SCREENED UCITS ETF 1C US,,https://www.charles-stanley-direct.co.uk/ViewShare?InvestmentId=s6Ai1NnqppE%3D
XTRACKERS MSCI INDONESIA SWAP UCITS ETF 1 USD ACC,,https://www.charles-stanley-direct.co.uk/ViewShare?InvestmentId=eycT8U6BKrU%3D
FRANKLIN TEMPLETON ICAV FRANKLIN EM MULTIFACTOR EQUITY UCITS ETF,,https://www.charles-stanley-direct.co.uk/ViewShare?InvestmentId=awobJP3x2ys%3D
INVESCO MARKETS II PLC MSCI WORLD UNIV SCREENED UCITS ETF USD,,https://www.charles-stanley-direct.co.uk/ViewShare?InvestmentId=aXTiyJJgYNY%3D
ISHARES IV PLC MSCI USA ESG ENH CTB USD ETF DIST,,https://www.charles-stanley-direct.co.uk/ViewShare?InvestmentId=2coNQrvIYPQ%3D
AMUNDI LUXEMBOURG SA CORE MSCI EMR MKTS UCITS ETF EUR DIST,,https://www.charles-stanley-direct.co.uk/ViewShare?InvestmentId=JR5R4ub2rTI%3D
AMUNDI INDEX SOLUTIONS EUR CORP BD UCITS ETF DR EUR (D),,https://www.charles-stanley-direct.co.uk/ViewShare?InvestmentId=NUD26OtZlnI%3D
MULTI UNITS LUXEMBOURG AMNDI MSCI EUROPE ESG SLCT UCITS ETF ACC,,https://www.charles-stanley-direct.co.uk/ViewShare?InvestmentId=ocqQHj7%2F4X8%3D
ISHARES IV PLC MSCI WLD ESG ENHANCED UCITS ETF GBP DIS,,https://www.charles-stanley-direct.co.uk/ViewShare?InvestmentId=sQjNudteY2U%3D
ISHARES IV PLC MSC WRLD SCRND UCTS ETF GB H DIS,,https://www.charles-stanley-direct.co.uk/ViewShare?InvestmentId=rOjw0ovU7DE%3D
VANGUARD FUNDS PLC VGI ESG EM ALL CAP ETF (USD) ACC,,https://www.charles-stanley-direct.co.uk/ViewShare?InvestmentId=j0qGmQr42%2FY%3D
VANGUARD FUNDS PLC VGI ESG EM ALL CAP ETF (USD) DIST,,https://www.charles-stanley-direct.co.uk/ViewShare?InvestmentId=WsjneAKc458%3D
VANGUARD FUNDS PLC VANGUARD ESG NA ALL CAP UCITS ETF USDACC,,https://www.charles-stanley-direct.co.uk/ViewShare?InvestmentId=DS4iijK1LRw%3D
AMUNDI INDEX SOLUTIONS AMUNDI IDX MSCI EUROPE SRI PAB UCITS ETF,,https://www.charles-stanley-direct.co.uk/ViewShare?InvestmentId=CNJs89uyCE4%3D
AMUNDI INDEX SOLUTIONS AMUNDI IDX MSCI EUROPE SRI PAB UCITS ETF,,https://www.charles-stanley-direct.co.uk/ViewShare?InvestmentId=bE4DA50nnvc%3D
XTRACKERS (IE) PLC US TREASURS ULTRASHT BD UCITS ETF 1C USD,,https://www.charles-stanley-direct.co.uk/ViewShare?InvestmentId=tibvtYZpklM%3D
XTRACKERS (IE) PLC US TREASURS ULTRASHT BD UCITS ETF 1C GBP,,https://www.charles-stanley-direct.co.uk/ViewShare?InvestmentId=GlLRv2sR%2BJ8%3D
XTRACKERS (IE) PLC MSCI GLOBAL SDG IMPACT UCITS ETF 1C USD,,https://www.charles-stanley-direct.co.uk/ViewShare?InvestmentId=uhW%2BtL8qG8U%3D
XTRACKERS (IE) PLC MSCI GLOBAL SDG IMPACT UCITS ETF 1C USD(,,https://www.charles-stanley-direct.co.uk/ViewShare?InvestmentId=0%2FA2xXwVE1U%3D
XTRACKERS (IE) PLC MSCI GLOBAL SDG 3 GOOD HEALTH UCITS ETF,,https://www.charles-stanley-direct.co.uk/ViewShare?InvestmentId=RHEcJijt7TM%3D
VANGUARD FUNDS PLC VANGUARD FTSE DEV WORLD UCT ETF USD DIS,,https://www.charles-stanley-direct.co.uk/ViewShare?InvestmentId=siUh1ZUYpik%3D
INVESCO MARKETS II PLC GBP CORPORATE BOND UCITS ETF GBP DIS,,https://www.charles-stanley-direct.co.uk/ViewShare?InvestmentId=ScRnvQl%2F9Es%3D
AMUNDI INDEX SOLUTIONS AMUNDI CORE GLOBAL GOV BOND ETF GBP H,,https://www.charles-stanley-direct.co.uk/ViewShare?InvestmentId=6uPuAxmcHuA%3D
INVESCO MARKETS III PLC INVESCO GBL BUYBACK ACHIEVERS UCT ETF US,,https://www.charles-stanley-direct.co.uk/ViewShare?InvestmentId=1mcQHBLB4pg%3D
AMUNDI INDEX SOLUTIONS AMND CORE GLOBAL AGGR BOND UCITS ETF ACC,,https://www.charles-stanley-direct.co.uk/ViewShare?InvestmentId=IqCUM%2F12Hwo%3D
ISHARES III PLC BROAD GLOBAL GOVT BOND UCITS ETF GBP DIS,,https://www.charles-stanley-direct.co.uk/ViewShare?InvestmentId=dE3sH%2F49oIc%3D
FIDELITY UCITS ICAV EUROPE EQUITY RES ENH UCITS ETF EUR ACC,,https://www.charles-stanley-direct.co.uk/ViewShare?InvestmentId=GoXoND74Ze8%3D
ISHARES IV PLC MSCI USA SRI UCITS ETF GBP DIS HDG,,https://www.charles-stanley-direct.co.uk/ViewShare?InvestmentId=Fd51xC%2FVie0%3D
FIDELITY UCITS ICAV JAPAN EQUITY RES ENH UCITS ETF JPY ACC,,https://www.charles-stanley-direct.co.uk/ViewShare?InvestmentId=z%2FkdJO1JlSw%3D
ISHARES VI PLC MSCI EUROPE FINANC SEC UCITS ETF GBP ACC,,https://www.charles-stanley-direct.co.uk/ViewShare?InvestmentId=rjWT8E9O0tc%3D
ISHARES IV PLC CHINA CNY BOND UCITS ETF GBP DIS HEDGED,,https://www.charles-stanley-direct.co.uk/ViewShare?InvestmentId=bUdgh9iGtZE%3D
VANGUARD FUNDS PLC USD CORPORATE BD UCITS ETF GBP ACC HDG,,https://www.charles-stanley-direct.co.uk/ViewShare?InvestmentId=V05zRZ5b7B4%3D
XTRACKERS (IE) PLC USD HIG YLD CORP BD SCREENED UCITS ETF,,https://www.charles-stanley-direct.co.uk/ViewShare?InvestmentId=CwMYL6wSDJ4%3D
AMUNDI INDEX SOLUTIONS AMND CORE STOXX EUROPE 600 UCITS ETF ACC,,https://www.charles-stanley-direct.co.uk/ViewShare?InvestmentId=JIDwa3wE4Xk%3D
INVESCO MARKETS II PLC GLOBAL CLEAN ENERGY UCITS ETF USD ACC,,https://www.charles-stanley-direct.co.uk/ViewShare?InvestmentId=tdcsuWbt0FI%3D
INVESCO MARKETS II PLC GLOBAL CLEAN ENERGY UCITS ETF USD(GBP) A,,https://www.charles-stanley-direct.co.uk/ViewShare?InvestmentId=v3tt%2BjHTUY0%3D
INVESCO MARKETS II PLC GLOBAL CLEAN ENERGY UCITS ETF USD DIS,,https://www.charles-stanley-direct.co.uk/ViewShare?InvestmentId=O4JPovJOz8c%3D
INVESCO MARKETS II PLC GLOBAL CLEAN ENERGY UCITS ETF GBP DIS,,https://www.charles-stanley-direct.co.uk/ViewShare?InvestmentId=5mDd9SPUKgw%3D
XTRACKERS (IE) PLC MSCI AC WORLD ESG SCREENED UCITS ETF 1C,,https://www.charles-stanley-direct.co.uk/ViewShare?InvestmentId=J3Dc56FT8BQ%3D
ISHARES V PLC IBONDS DEC 2029 TERM USD CORP UCITS ETF,,https://www.charles-stanley-direct.co.uk/ViewShare?InvestmentId=1RcOpvk%2F%2BgY%3D
ROBECO UCITS ICAV 3D US EQUITY UCITS ETF GBP HGD ACC,,https://www.charles-stanley-direct.co.uk/ViewShare?InvestmentId=RO%2FoVX6QoL8%3D
FIRST TRUST GLOBAL FUNDS ICAV FT INDXX EUROPE INFRASTRUCTURE UCITS ETF,,https://www.charles-stanley-direct.co.uk/ViewShare?InvestmentId=bTbwny51KyM%3D
VANGUARD FUNDS PLC VANGUARD USD TSY BD UCITS ETF GBP DISHGD,,https://www.charles-stanley-direct.co.uk/ViewShare?InvestmentId=ZxPoP9SK%2FBA%3D
ISHARES IV PLC MSCI EM EX CHINA UCITS ETF USD ACC,,https://www.charles-stanley-direct.co.uk/ViewShare?InvestmentId=OA6HUSnHEak%3D
WISDOMTREE ISSUER ICAV GLOBAL QLTY DIV GWTH UCITS ETF GBP DIS,,https://www.charles-stanley-direct.co.uk/ViewShare?InvestmentId=5UVGBmcVjEM%3D
ISHARES IV PLC EDG MSCI EUR MOMN FAC UCITS ETF ACC,,https://www.charles-stanley-direct.co.uk/ViewShare?InvestmentId=xXODU%2FDkNB4%3D
WISDOMTREE ISSUER ICAV WISDOMTREE US EQTY INC UCITS ETF USD DIS,,https://www.charles-stanley-direct.co.uk/ViewShare?InvestmentId=1VLUy7s6vzo%3D
ISHARES VI PLC ISHARES MSCI WORLD SWAP UCITS ETF GBP HE,,https://www.charles-stanley-direct.co.uk/ViewShare?InvestmentId=sfvu9nDl8wA%3D
FRANKLIN TEMPLETON ICAV FRANKLIN FTSE EMG MKTS UCITS ETF USD ACC,,https://www.charles-stanley-direct.co.uk/ViewShare?InvestmentId=EsK8U5wSjE0%3D
FRANKLIN TEMPLETON ICAV FRANKLIN FTSE EMG EX CHINA UCITS ETF USD,,https://www.charles-stanley-direct.co.uk/ViewShare?InvestmentId=s7R1DGL12OQ%3D
XTRACKERS (IE) PLC MSCI WORLD COM SERVICES UCITS ETF 1C USD,,https://www.charles-stanley-direct.co.uk/ViewShare?InvestmentId=Il%2F6nsjzD%2F0%3D
XTRACKERS (IE) PLC MSCI WORLD CONS DISCRET UCITS ETF 1C USD,,https://www.charles-stanley-direct.co.uk/ViewShare?InvestmentId=sNuBuFP6bsc%3D
XTRACKERS (IE) PLC MSCI WORLD CONS STAPLES UCITS ETF 1C USD,,https://www.charles-stanley-direct.co.uk/ViewShare?InvestmentId=7GKsHEYQ3a0%3D
